Season,Competition,Matchday,Date,Venue,Club,Opponent,Result,Playing_Position,Minute,At_score,Type,Goal_assist,Category,Organizer,MatchStage,Date_clean,Date_Year,Result_clean,Goals1,Goals2,Goals_Team,Goals_Opponent,Decision,Play_Position_clean,Minute_clean
2002/2003,Liga Portugal,6,10-07-02,H,Sporting CP,Moreirense FC,3:00,LW,34,2:00,Solo run,No assist,National Leagues,Portuguese Football Federation (FPF),Matchday,2002-10-07,2002,3:00,3,0,3,0,Normal,LW,34
2002/2003,Liga Portugal,6,10-07-02,H,Sporting CP,Moreirense FC,3:00,LW,90+5,3:00,Header,Rui Jorge,National Leagues,Portuguese Football Federation (FPF),Matchday,2002-10-07,2002,3:00,3,0,3,0,Normal,LW,95
2002/2003,Liga Portugal,8,10/26/02,A,Sporting CP,Boavista FC,1:02,,88,1:02,Right-footed shot,Carlos Martins,National Leagues,Portuguese Football Federation (FPF),Matchday,2002-10-26,2002,1:02,1,2,2,1,Normal,LW,88
2002/2003,Taca de Portugal Placard,Round 4,11/24/02,H,Sporting CP,CD Estarreja,4:01,,67,3:00,Left-footed shot,Cesar Prates,National Cups,Portuguese Football Federation (FPF),Stage,2002-11-24,2002,4:01,4,1,4,1,Normal,LW,67
2002/2003,Taca de Portugal Placard,Round 5,12/18/02,H,Sporting CP,FC Oliveira do Hospital,8:01,,13,3:00,Right-footed shot,No assist,National Cups,Portuguese Football Federation (FPF),Stage,2002-12-18,2002,8:01,8,1,8,1,Normal,LW,13
2003/2004,Premier League,11,11-01-03,H,Manchester United,Portsmouth FC,3:00,RW,80,2:00,Direct free kick,No assist,National Leagues,English Football Association (FA),Matchday,2003-11-01,2003,3:00,3,0,3,0,Normal,RW,80
2003/2004,FA Cup,Round 5,2/14/04,H,Manchester United,Manchester City,4:02,RW,74,3:00,Right-footed shot,No assist,National Cups,English Football Association (FA),Stage,2004-02-14,2004,4:02,4,2,4,2,Normal,RW,74
2003/2004,Premier League,29,3/20/04,H,Manchester United,Tottenham Hotspur,3:00,,89,2:00,Right-footed shot,No assist,National Leagues,English Football Association (FA),Matchday,2004-03-20,2004,3:00,3,0,3,0,Normal,LW,89
2003/2004,Premier League,32,04-10-04,A,Manchester United,Birmingham City,1:02,,60,1:01,Header,Ryan Giggs,National Leagues,English Football Association (FA),Matchday,2004-04-10,2004,1:02,1,2,2,1,Normal,LW,60
2003/2004,Premier League,38,5/15/04,A,Manchester United,Aston Villa,0:02,,4,0:01,Right-footed shot,No assist,National Leagues,English Football Association (FA),Matchday,2004-05-15,2004,0:02,0,2,2,0,Normal,LW,4
2003/2004,FA Cup,Final,5/22/04,H,Manchester United,Millwall FC,3:00,RW,44,1:00,Header,Gary Neville,National Cups,English Football Association (FA),Stage,2004-05-22,2004,3:00,3,0,3,0,Normal,RW,44
2004/2005,Premier League,16,12-04-04,H,Manchester United,Southampton FC,3:00,,87,3:00,Right-footed shot,Gary Neville,National Leagues,English Football Association (FA),Matchday,2004-12-04,2004,3:00,3,0,3,0,Normal,LW,87
2004/2005,FA Cup,Round 3,1/19/05,A,Manchester United,Exeter City,0:02,,9,0:01,Right-footed shot,Paul Scholes,National Cups,English Football Association (FA),Stage,2005-01-19,2005,0:02,0,2,2,0,Normal,LW,9
2004/2005,Premier League,24,1/22/05,H,Manchester United,Aston Villa,3:01,,8,1:00,Right-footed shot,Louis Saha,National Leagues,English Football Association (FA),Matchday,2005-01-22,2005,3:01,3,1,3,1,Normal,LW,8
2004/2005,Premier League,25,02-01-05,A,Manchester United,Arsenal FC,2:04,RW,54,2:02,Left-footed shot,Ryan Giggs,National Leagues,English Football Association (FA),Matchday,2005-02-01,2005,2:04,2,4,4,2,Normal,RW,54
2004/2005,Premier League,25,02-01-05,A,Manchester United,Arsenal FC,2:04,RW,58,2:03,Tap-in,Ryan Giggs,National Leagues,English Football Association (FA),Matchday,2005-02-01,2005,2:04,2,4,4,2,Normal,RW,58
2004/2005,FA Cup,Round 5,2/19/05,A,Manchester United,Everton FC,0:02,,58,0:02,Tap-in,Paul Scholes,National Cups,English Football Association (FA),Stage,2005-02-19,2005,0:02,0,2,2,0,Normal,LW,58
2004/2005,FA Cup,Round 6,03-12-05,A,Manchester United,Southampton FC,0:04,,45+1,0:02,Left-footed shot,Ruud van Nistelrooy,National Cups,English Football Association (FA),Stage,2005-03-12,2005,0:04,0,4,4,0,Normal,LW,46
2004/2005,Premier League,30,3/19/05,H,Manchester United,Fulham FC,1:00,,21,1:00,Right-footed shot,Roy Keane,National Leagues,English Football Association (FA),Matchday,2005-03-19,2005,1:00,1,0,1,0,Normal,LW,21
2004/2005,FA Cup,Semi-Finals,4/17/05,A,Manchester United,Newcastle United,1:04,RW,76,1:04,Right-footed shot,Ruud van Nistelrooy,National Cups,English Football Association (FA),Stage,2005-04-17,2005,1:04,1,4,4,1,Normal,RW,76
2005/2006,UEFA Champions League Qualifying,Round 3,08-09-05,H,Manchester United,Debreceni VSC,3:00,,63,3:00,Right-footed shot,Paul Scholes,International,UEFA,Stage,2005-08-09,2005,3:00,3,0,3,0,Normal,LW,63
2005/2006,Premier League,11,10/29/05,A,Manchester United,Middlesbrough FC,4:01,,90,4:01,Header,Paul Scholes,National Leagues,English Football Association (FA),Matchday,2005-10-29,2005,4:01,4,1,1,4,Normal,LW,90
2005/2006,EFL Cup,Last 16,11/30/05,H,Manchester United,West Bromwich Albion,3:01,RW,12,1:01,Penalty,No assist,National Cups,English Football Association (FA),Stage,2005-11-30,2005,3:01,3,1,3,1,Normal,RW,12
2005/2006,Premier League,20,12/31/05,H,Manchester United,Bolton Wanderers,4:01,,68,3:01,Right-footed shot,Wayne Rooney,National Leagues,English Football Association (FA),Matchday,2005-12-31,2005,4:01,4,1,4,1,Normal,LW,68
2005/2006,Premier League,20,12/31/05,H,Manchester United,Bolton Wanderers,4:01,,90,4:01,Left-footed shot,Ruud van Nistelrooy,National Leagues,English Football Association (FA),Matchday,2005-12-31,2005,4:01,4,1,4,1,Normal,LW,90
2005/2006,Premier League,25,02-04-06,H,Manchester United,Fulham FC,4:02,,14,2:00,Direct free kick,No assist,National Leagues,English Football Association (FA),Matchday,2006-02-04,2006,4:02,4,2,4,2,Normal,LW,14
2005/2006,Premier League,25,02-04-06,H,Manchester United,Fulham FC,4:02,,87,4:02,Right-footed shot,No assist,National Leagues,English Football Association (FA),Matchday,2006-02-04,2006,4:02,4,2,4,2,Normal,LW,87
2005/2006,Premier League,26,02-11-06,A,Manchester United,Portsmouth FC,1:03,RW,38,0:02,Left-footed shot,No assist,National Leagues,English Football Association (FA),Matchday,2006-02-11,2006,1:03,1,3,3,1,Normal,RW,38
2005/2006,Premier League,26,02-11-06,A,Manchester United,Portsmouth FC,1:03,RW,45,0:03,Right-footed shot,Wayne Rooney,National Leagues,English Football Association (FA),Matchday,2006-02-11,2006,1:03,1,3,3,1,Normal,RW,45
2005/2006,EFL Cup,Final,2/26/06,H,Manchester United,Wigan Athletic,4:00,RW,59,3:00,Right-footed shot,Louis Saha,National Cups,English Football Association (FA),Stage,2006-02-26,2006,4:00,4,0,4,0,Normal,RW,59
2005/2006,Premier League,28,03-06-06,A,Manchester United,Wigan Athletic,1:02,,74,1:01,Right-footed shot,Ruud van Nistelrooy,National Leagues,English Football Association (FA),Matchday,2006-03-06,2006,1:02,1,2,2,1,Normal,LW,74
2005/2006,Premier League,38,05-07-06,H,Manchester United,Charlton Athletic,4:00,RW,23,2:00,Left-footed shot,Ryan Giggs,National Leagues,English Football Association (FA),Matchday,2006-05-07,2006,4:00,4,0,4,0,Normal,RW,23
2006/2007,Premier League,1,8/20/06,H,Manchester United,Fulham FC,5:01,,19,4:00,Right-footed shot,Wayne Rooney,National Leagues,English Football Association (FA),Matchday,2006-08-20,2006,5:01,5,1,5,1,Normal,LW,19
2006/2007,Premier League,6,9/23/06,A,Manchester United,Reading FC,1:01,CF,73,1:01,Right-footed shot,John OShea,National Leagues,English Football Association (FA),Matchday,2006-09-23,2006,1:01,1,1,1,1,Normal,CF,73
2006/2007,Premier League,10,10/28/06,A,Manchester United,Bolton Wanderers,0:04,,82,0:03,Right-footed shot,Louis Saha,National Leagues,English Football Association (FA),Matchday,2006-10-28,2006,0:04,0,4,4,0,Normal,LW,82
2006/2007,Premier League,11,11-04-06,H,Manchester United,Portsmouth FC,3:00,RW,10,2:00,Direct free kick,No assist,National Leagues,English Football Association (FA),Matchday,2006-11-04,2006,3:00,3,0,3,0,Normal,RW,10
2006/2007,Premier League,15,11/29/06,H,Manchester United,Everton FC,3:00,,39,1:00,Right-footed shot,No assist,National Leagues,English Football Association (FA),Matchday,2006-11-29,2006,3:00,3,0,3,0,Normal,LW,39
2006/2007,Premier League,17,12-09-06,H,Manchester United,Manchester City,3:01,,84,3:01,Right-footed shot,No assist,National Leagues,English Football Association (FA),Matchday,2006-12-09,2006,3:01,3,1,3,1,Normal,LW,84
2006/2007,Premier League,19,12/23/06,A,Manchester United,Aston Villa,0:03,,58,0:01,Right-footed shot,No assist,National Leagues,English Football Association (FA),Matchday,2006-12-23,2006,0:03,0,3,3,0,Normal,LW,58
2006/2007,Premier League,19,12/23/06,A,Manchester United,Aston Villa,0:03,,85,0:03,Right-footed shot,Gary Neville,National Leagues,English Football Association (FA),Matchday,2006-12-23,2006,0:03,0,3,3,0,Normal,LW,85
2006/2007,Premier League,20,12/26/06,H,Manchester United,Wigan Athletic,3:01,,47,1:00,Right-footed shot,Paul Scholes,National Leagues,English Football Association (FA),Matchday,2006-12-26,2006,3:01,3,1,3,1,Normal,LW,47
2006/2007,Premier League,20,12/26/06,H,Manchester United,Wigan Athletic,3:01,,50,2:00,Penalty rebound,Ji-sung Park,National Leagues,English Football Association (FA),Matchday,2006-12-26,2006,3:01,3,1,3,1,Normal,LW,50
2006/2007,Premier League,21,12/30/06,H,Manchester United,Reading FC,3:02,RW,58,2:01,Right-footed shot,Ole Gunnar Solskjaer,National Leagues,English Football Association (FA),Matchday,2006-12-30,2006,3:02,3,2,3,2,Normal,RW,58
2006/2007,Premier League,21,12/30/06,H,Manchester United,Reading FC,3:02,RW,77,3:01,Right-footed shot,Ryan Giggs,National Leagues,English Football Association (FA),Matchday,2006-12-30,2006,3:02,3,2,3,2,Normal,RW,77
2006/2007,Premier League,23,1/13/07,H,Manchester United,Aston Villa,3:01,,34,3:00,Header,Michael Carrick,National Leagues,English Football Association (FA),Matchday,2007-01-13,2007,3:01,3,1,3,1,Normal,LW,34
2006/2007,Premier League,25,1/31/07,H,Manchester United,Watford FC,4:00,RW,12,1:00,Penalty,No assist,National Leagues,English Football Association (FA),Matchday,2007-01-31,2007,4:00,4,0,4,0,Normal,RW,12
2006/2007,Premier League,26,02-03-07,A,Manchester United,Tottenham Hotspur,0:04,RW,45,0:01,Penalty,No assist,National Leagues,English Football Association (FA),Matchday,2007-02-03,2007,0:04,0,4,4,0,Normal,RW,45
2006/2007,Premier League,28,2/24/07,A,Manchester United,Fulham FC,1:02,,88,1:02,Solo run,No assist,National Leagues,English Football Association (FA),Matchday,2007-02-24,2007,1:02,1,2,2,1,Normal,LW,88
2006/2007,FA Cup,Round 6,03-10-07,A,Manchester United,Middlesbrough FC,2:02,RW,68,2:02,Penalty,No assist,National Cups,English Football Association (FA),Stage,2007-03-10,2007,2:02,2,2,2,2,Normal,RW,68
2006/2007,FA Cup,Round 6,3/19/07,H,Manchester United,Middlesbrough FC,1:00,,76,1:00,Penalty,No assist,National Cups,English Football Association (FA),Stage,2007-03-19,2007,1:00,1,0,1,0,Normal,LW,76
2006/2007,UEFA Champions League,Quarter-Finals,04-10-07,H,Manchester United,AS Roma,7:01,RW,44,4:00,Right-footed shot,Ryan Giggs,International,UEFA,Stage,2007-04-10,2007,7:01,7,1,7,1,Normal,RW,44
2006/2007,UEFA Champions League,Quarter-Finals,04-10-07,H,Manchester United,AS Roma,7:01,RW,49,5:00,Right-footed shot,Ryan Giggs,International,UEFA,Stage,2007-04-10,2007,7:01,7,1,7,1,Normal,RW,49
2006/2007,FA Cup,Semi-Finals,4/14/07,A,Manchester United,Watford FC,1:04,,28,1:02,Right-footed shot,Wayne Rooney,National Cups,English Football Association (FA),Stage,2007-04-14,2007,1:04,1,4,4,1,Normal,LW,28
2006/2007,UEFA Champions League,Semi-Finals,4/24/07,H,Manchester United,AC Milan,3:02,RW,5,1:00,Header,Ryan Giggs,International,UEFA,Stage,2007-04-24,2007,3:02,3,2,3,2,Normal,RW,5
2006/2007,Premier League,37,05-05-07,A,Manchester United,Manchester City,0:01,RW,34,0:01,Penalty,No assist,National Leagues,English Football Association (FA),Matchday,2007-05-05,2007,0:01,0,1,1,0,Normal,RW,34
2007/2008,UEFA Champions League,Group Stage,9/19/07,A,Manchester United,Sporting CP,0:01,RW,62,0:01,Header,Wes Brown,International,UEFA,Stage,2007-09-19,2007,0:01,0,1,1,0,Normal,RW,62
2007/2008,Premier League,8,9/29/07,A,Manchester United,Birmingham City,0:01,RW,51,0:01,Right-footed shot,No assist,National Leagues,English Football Association (FA),Matchday,2007-09-29,2007,0:01,0,1,1,0,Normal,RW,51
2007/2008,Premier League,9,10-06-07,H,Manchester United,Wigan Athletic,4:00,RW,59,2:00,Header,Ryan Giggs,National Leagues,English Football Association (FA),Matchday,2007-10-06,2007,4:00,4,0,4,0,Normal,RW,59
2007/2008,Premier League,9,10-06-07,H,Manchester United,Wigan Athletic,4:00,RW,76,3:00,Right-footed shot,Wayne Rooney,National Leagues,English Football Association (FA),Matchday,2007-10-06,2007,4:00,4,0,4,0,Normal,RW,76
2007/2008,UEFA Champions League,Group Stage,10/23/07,A,Manchester United,Dynamo Kyiv,2:04,RW,41,1:03,Penalty,No assist,International,UEFA,Stage,2007-10-23,2007,2:04,2,4,4,2,Normal,RW,41
2007/2008,UEFA Champions League,Group Stage,10/23/07,A,Manchester United,Dynamo Kyiv,2:04,RW,68,1:04,Header,Ryan Giggs,International,UEFA,Stage,2007-10-23,2007,2:04,2,4,4,2,Normal,RW,68
2007/2008,Premier League,12,11-03-07,A,Manchester United,Arsenal FC,2:02,RW,82,1:02,Right-footed shot,Patrice Evra,National Leagues,English Football Association (FA),Matchday,2007-11-03,2007,2:02,2,2,2,2,Normal,RW,82
2007/2008,UEFA Champions League,Group Stage,11-07-07,H,Manchester United,Dynamo Kyiv,4:00,RW,88,4:00,Right-footed shot,Patrice Evra,International,UEFA,Stage,2007-11-07,2007,4:00,4,0,4,0,Normal,RW,88
2007/2008,Premier League,13,11-11-07,H,Manchester United,Blackburn Rovers,2:00,RW,34,1:00,Header,Ryan Giggs,National Leagues,English Football Association (FA),Matchday,2007-11-11,2007,2:00,2,0,2,0,Normal,RW,34
2007/2008,Premier League,13,11-11-07,H,Manchester United,Blackburn Rovers,2:00,RW,35,2:00,Right-footed shot,Carlos Tevez,National Leagues,English Football Association (FA),Matchday,2007-11-11,2007,2:00,2,0,2,0,Normal,RW,35
2007/2008,UEFA Champions League,Group Stage,11/27/07,H,Manchester United,Sporting CP,2:01,RW,90+3,2:01,Direct free kick,No assist,International,UEFA,Stage,2007-11-27,2007,2:01,2,1,2,1,Normal,RW,93
2007/2008,Premier League,15,12-03-07,H,Manchester United,Fulham FC,2:00,,10,1:00,Right-footed shot,Nemanja Vidic‎,National Leagues,English Football Association (FA),Matchday,2007-12-03,2007,2:00,2,0,2,0,Normal,LW,10
2007/2008,Premier League,15,12-03-07,H,Manchester United,Fulham FC,2:00,,58,2:00,Header,John OShea,National Leagues,English Football Association (FA),Matchday,2007-12-03,2007,2:00,2,0,2,0,Normal,LW,58
2007/2008,Premier League,16,12-08-07,H,Manchester United,Derby County,4:01,,90,4:01,Penalty,No assist,National Leagues,English Football Association (FA),Matchday,2007-12-08,2007,4:01,4,1,4,1,Normal,LW,90
2007/2008,Premier League,18,12/23/07,H,Manchester United,Everton FC,2:01,RW,22,1:00,Left-footed shot,Carlos Tevez,National Leagues,English Football Association (FA),Matchday,2007-12-23,2007,2:01,2,1,2,1,Normal,RW,22
2007/2008,Premier League,18,12/23/07,H,Manchester United,Everton FC,2:01,RW,87,2:01,Penalty,No assist,National Leagues,English Football Association (FA),Matchday,2007-12-23,2007,2:01,2,1,2,1,Normal,RW,87
2007/2008,Premier League,19,12/26/07,A,Manchester United,Sunderland AFC,0:04,,45,0:03,Direct free kick,No assist,National Leagues,English Football Association (FA),Matchday,2007-12-26,2007,0:04,0,4,4,0,Normal,LW,45
2007/2008,Premier League,20,12/29/07,A,Manchester United,West Ham United,2:01,RW,14,0:01,Header,Ryan Giggs,National Leagues,English Football Association (FA),Matchday,2007-12-29,2007,2:01,2,1,1,2,Normal,RW,14
2007/2008,FA Cup,Round 3,01-05-08,A,Manchester United,Aston Villa,0:02,,81,0:01,Left-footed shot,Ryan Giggs,National Cups,English Football Association (FA),Stage,2008-01-05,2008,0:02,0,2,2,0,Normal,LW,81
2007/2008,Premier League,22,01-12-08,H,Manchester United,Newcastle United,6:00,RW,48,1:00,Direct free kick,No assist,National Leagues,English Football Association (FA),Matchday,2008-01-12,2008,6:00,6,0,6,0,Normal,RW,48
2007/2008,Premier League,22,01-12-08,H,Manchester United,Newcastle United,6:00,RW,70,3:00,Right-footed shot,Carlos Tevez,National Leagues,English Football Association (FA),Matchday,2008-01-12,2008,6:00,6,0,6,0,Normal,RW,70
2007/2008,Premier League,22,01-12-08,H,Manchester United,Newcastle United,6:00,RW,88,5:00,Left-footed shot,No assist,National Leagues,English Football Association (FA),Matchday,2008-01-12,2008,6:00,6,0,6,0,Normal,RW,88
2007/2008,Premier League,23,1/19/08,A,Manchester United,Reading FC,0:02,RW,90+2,0:02,Right-footed shot,No assist,National Leagues,English Football Association (FA),Matchday,2008-01-19,2008,0:02,0,2,2,0,Normal,RW,92
2007/2008,FA Cup,Round 4,1/27/08,H,Manchester United,Tottenham Hotspur,3:01,RW,69,2:01,Penalty,No assist,National Cups,English Football Association (FA),Stage,2008-01-27,2008,3:01,3,1,3,1,Normal,RW,69
2007/2008,FA Cup,Round 4,1/27/08,H,Manchester United,Tottenham Hotspur,3:01,RW,88,3:01,Right-footed shot,Ryan Giggs,National Cups,English Football Association (FA),Stage,2008-01-27,2008,3:01,3,1,3,1,Normal,RW,88
2007/2008,Premier League,24,1/30/08,H,Manchester United,Portsmouth FC,2:00,RW,10,1:00,Right-footed shot,Nani,National Leagues,English Football Association (FA),Matchday,2008-01-30,2008,2:00,2,0,2,0,Normal,RW,10
2007/2008,Premier League,24,1/30/08,H,Manchester United,Portsmouth FC,2:00,RW,12,2:00,Direct free kick,No assist,National Leagues,English Football Association (FA),Matchday,2008-01-30,2008,2:00,2,0,2,0,Normal,RW,12
2007/2008,Premier League,27,2/23/08,A,Manchester United,Newcastle United,1:05,RW,45,0:02,Right-footed shot,Michael Carrick,National Leagues,English Football Association (FA),Matchday,2008-02-23,2008,1:05,1,5,5,1,Normal,RW,45
2007/2008,Premier League,27,2/23/08,A,Manchester United,Newcastle United,1:05,RW,56,0:03,Right-footed shot,No assist,National Leagues,English Football Association (FA),Matchday,2008-02-23,2008,1:05,1,5,5,1,Normal,RW,56
2007/2008,UEFA Champions League,Last 16,03-04-08,H,Manchester United,Olympique Lyon,1:00,RW,41,1:00,Left-footed shot,No assist,International,UEFA,Stage,2008-03-04,2008,1:00,1,0,1,0,Normal,RW,41
2007/2008,Premier League,29,3/15/08,A,Manchester United,Derby County,0:01,,76,0:01,Right-footed shot,Wayne Rooney,National Leagues,English Football Association (FA),Matchday,2008-03-15,2008,0:01,0,1,1,0,Normal,LW,76
2007/2008,Premier League,30,3/19/08,H,Manchester United,Bolton Wanderers,2:00,,8,1:00,Right-footed shot,No assist,National Leagues,English Football Association (FA),Matchday,2008-03-19,2008,2:00,2,0,2,0,Normal,LW,8
2007/2008,Premier League,30,3/19/08,H,Manchester United,Bolton Wanderers,2:00,,19,2:00,Direct free kick,No assist,National Leagues,English Football Association (FA),Matchday,2008-03-19,2008,2:00,2,0,2,0,Normal,LW,19
2007/2008,Premier League,31,3/23/08,H,Manchester United,Liverpool FC,3:00,RW,79,2:00,Header,Nani,National Leagues,English Football Association (FA),Matchday,2008-03-23,2008,3:00,3,0,3,0,Normal,RW,79
2007/2008,Premier League,32,3/29/08,H,Manchester United,Aston Villa,4:00,RW,16,1:00,Right-footed shot,No assist,National Leagues,English Football Association (FA),Matchday,2008-03-29,2008,4:00,4,0,4,0,Normal,RW,16
2007/2008,UEFA Champions League,Quarter-Finals,04-01-08,A,Manchester United,AS Roma,0:02,RW,39,0:01,Header,Paul Scholes,International,UEFA,Stage,2008-04-01,2008,0:02,0,2,2,0,Normal,RW,39
2007/2008,Premier League,33,04-06-08,A,Manchester United,Middlesbrough FC,2:02,RW,9,0:01,Left-footed shot,Michael Carrick,National Leagues,English Football Association (FA),Matchday,2008-04-06,2008,2:02,2,2,2,2,Normal,RW,9
2007/2008,Premier League,34,4/13/08,H,Manchester United,Arsenal FC,2:01,RW,53,1:01,Penalty,No assist,National Leagues,English Football Association (FA),Matchday,2008-04-13,2008,2:01,2,1,2,1,Normal,RW,53
2007/2008,Premier League,37,05-03-08,H,Manchester United,West Ham United,4:01,RW,3,1:00,Right-footed shot,Edwin van der Sar,National Leagues,English Football Association (FA),Matchday,2008-05-03,2008,4:01,4,1,4,1,Normal,RW,3
2007/2008,Premier League,37,05-03-08,H,Manchester United,West Ham United,4:01,RW,24,2:00,Right-footed shot,Owen Hargreaves,National Leagues,English Football Association (FA),Matchday,2008-05-03,2008,4:01,4,1,4,1,Normal,RW,24
2007/2008,Premier League,38,05-11-08,A,Manchester United,Wigan Athletic,0:02,RW,32,0:01,Penalty,No assist,National Leagues,English Football Association (FA),Matchday,2008-05-11,2008,0:02,0,2,2,0,Normal,RW,32
2007/2008,UEFA Champions League,Final,5/21/08,H,Manchester United,Chelsea FC,6:5 on pens,LW,26,1:00,Header,Wes Brown,International,UEFA,Stage,2008-05-21,2008,6:5,6,5,6,5,Penalties,LW,26
2008/2009,EFL Cup,Round 3,9/23/08,H,Manchester United,Middlesbrough FC,3:01,,25,1:00,Header,Ryan Giggs,National Cups,English Football Association (FA),Stage,2008-09-23,2008,3:01,3,1,3,1,Normal,LW,25
2008/2009,Premier League,6,9/27/08,H,Manchester United,Bolton Wanderers,2:00,RW,59,1:00,Penalty,No assist,National Leagues,English Football Association (FA),Matchday,2008-09-27,2008,2:00,2,0,2,0,Normal,RW,59
2008/2009,Premier League,8,10/18/08,H,Manchester United,West Bromwich Albion,4:00,RW,69,2:00,Left-footed shot,Wayne Rooney,National Leagues,English Football Association (FA),Matchday,2008-10-18,2008,4:00,4,0,4,0,Normal,RW,69
2008/2009,Premier League,10,10/29/08,H,Manchester United,West Ham United,2:00,RW,14,1:00,Left-footed shot,Nani,National Leagues,English Football Association (FA),Matchday,2008-10-29,2008,2:00,2,0,2,0,Normal,RW,14
2008/2009,Premier League,10,10/29/08,H,Manchester United,West Ham United,2:00,RW,30,2:00,Right-footed shot,Dimitar Berbatov,National Leagues,English Football Association (FA),Matchday,2008-10-29,2008,2:00,2,0,2,0,Normal,RW,30
2008/2009,Premier League,11,11-01-08,H,Manchester United,Hull City,4:03,RW,3,1:00,Left-footed shot,Dimitar Berbatov,National Leagues,English Football Association (FA),Matchday,2008-11-01,2008,4:03,4,3,4,3,Normal,RW,3
2008/2009,Premier League,11,11-01-08,H,Manchester United,Hull City,4:03,RW,43,3:01,Header,Nani,National Leagues,English Football Association (FA),Matchday,2008-11-01,2008,4:03,4,3,4,3,Normal,RW,43
2008/2009,Premier League,13,11/15/08,H,Manchester United,Stoke City,5:00,RW,3,1:00,Direct free kick,No assist,National Leagues,English Football Association (FA),Matchday,2008-11-15,2008,5:00,5,0,5,0,Normal,RW,3
2008/2009,Premier League,13,11/15/08,H,Manchester United,Stoke City,5:00,RW,88,5:00,Direct free kick,No assist,National Leagues,English Football Association (FA),Matchday,2008-11-15,2008,5:00,5,0,5,0,Normal,RW,88
2008/2009,FIFA Club World Cup,Semi-Finals,12/18/08,A,Manchester United,Gamba Osaka,3:05,LW,45+1,0:02,Header,Ryan Giggs,International,FIFA,Stage,2008-12-18,2008,3:05,3,5,5,3,Normal,LW,46
2008/2009,EFL Cup,Semi-Finals,1/20/09,H,Manchester United,Derby County,4:02,,89,4:01,Penalty,No assist,National Cups,English Football Association (FA),Stage,2009-01-20,2009,4:02,4,2,4,2,Normal,LW,89
2008/2009,Premier League,23,1/27/09,A,Manchester United,West Bromwich Albion,0:05,LW,65,0:04,Right-footed shot,Ryan Giggs,National Leagues,English Football Association (FA),Matchday,2009-01-27,2009,0:05,0,5,5,0,Normal,LW,65
2008/2009,Premier League,23,1/27/09,A,Manchester United,West Bromwich Albion,0:05,LW,73,0:05,Right-footed shot,Dimitar Berbatov,National Leagues,English Football Association (FA),Matchday,2009-01-27,2009,0:05,0,5,5,0,Normal,LW,73
2008/2009,Premier League,24,1/31/09,H,Manchester United,Everton FC,1:00,LW,43,1:00,Penalty,No assist,National Leagues,English Football Association (FA),Matchday,2009-01-31,2009,1:00,1,0,1,0,Normal,LW,43
2008/2009,FA Cup,Round 5,2/15/09,A,Manchester United,Derby County,1:04,CF,68,1:03,Header,Ryan Giggs,National Cups,English Football Association (FA),Stage,2009-02-15,2009,1:04,1,4,4,1,Normal,CF,68
2008/2009,Premier League,26,2/21/09,H,Manchester United,Blackburn Rovers,2:01,,60,2:01,Direct free kick,No assist,National Leagues,English Football Association (FA),Matchday,2009-02-21,2009,2:01,2,1,2,1,Normal,LW,60
2008/2009,UEFA Champions League,Last 16,03-11-09,H,Manchester United,FC Internazionale,2:00,RW,49,2:00,Header,Wayne Rooney,International,UEFA,Stage,2009-03-11,2009,2:00,2,0,2,0,Normal,RW,49
2008/2009,Premier League,29,3/14/09,H,Manchester United,Liverpool FC,1:04,RW,22,1:00,Penalty,No assist,National Leagues,English Football Association (FA),Matchday,2009-03-14,2009,1:04,1,4,1,4,Normal,RW,22
2008/2009,Premier League,31,04-05-09,H,Manchester United,Aston Villa,3:02,RW,11,1:00,Direct free kick,No assist,National Leagues,English Football Association (FA),Matchday,2009-04-05,2009,3:02,3,2,3,2,Normal,RW,11
2008/2009,Premier League,31,04-05-09,H,Manchester United,Aston Villa,3:02,RW,80,2:02,Left-footed shot,Michael Carrick,National Leagues,English Football Association (FA),Matchday,2009-04-05,2009,3:02,3,2,3,2,Normal,RW,80
2008/2009,UEFA Champions League,Quarter-Finals,4/15/09,A,Manchester United,FC Porto,0:01,RW,6,0:01,Long distance kick,Anderson,International,UEFA,Stage,2009-04-15,2009,0:01,0,1,1,0,Normal,RW,6
2008/2009,Premier League,34,4/25/09,H,Manchester United,Tottenham Hotspur,5:02,RW,57,1:02,Penalty,No assist,National Leagues,English Football Association (FA),Matchday,2009-04-25,2009,5:02,5,2,5,2,Normal,RW,57
2008/2009,Premier League,34,4/25/09,H,Manchester United,Tottenham Hotspur,5:02,RW,68,3:02,Header,Wayne Rooney,National Leagues,English Football Association (FA),Matchday,2009-04-25,2009,5:02,5,2,5,2,Normal,RW,68
2008/2009,UEFA Champions League,Semi-Finals,05-05-09,A,Manchester United,Arsenal FC,1:03,CF,11,0:02,Direct free kick,No assist,International,UEFA,Stage,2009-05-05,2009,1:03,1,3,3,1,Normal,CF,11
2008/2009,UEFA Champions League,Semi-Finals,05-05-09,A,Manchester United,Arsenal FC,1:03,CF,61,0:03,Right-footed shot,Wayne Rooney,International,UEFA,Stage,2009-05-05,2009,1:03,1,3,3,1,Normal,CF,61
2008/2009,Premier League,36,05-10-09,H,Manchester United,Manchester City,2:00,RW,17,1:00,Direct free kick,No assist,National Leagues,English Football Association (FA),Matchday,2009-05-10,2009,2:00,2,0,2,0,Normal,RW,17
2009/2010,LaLiga,1,8/29/09,H,Real Madrid,Deportivo de La Coruña,3:02,RW,35,2:01,Penalty,No assist,National Leagues,Spanish Football Federation (RFEF),Matchday,2009-08-29,2009,3:02,3,2,3,2,Normal,RW,35
2009/2010,LaLiga,2,09-12-09,A,Real Madrid,RCD Espanyol Barcelona,0:03,,90,0:03,Right-footed shot,Guti,National Leagues,Spanish Football Federation (RFEF),Matchday,2009-09-12,2009,0:03,0,3,3,0,Normal,LW,90
2009/2010,UEFA Champions League,Group Stage,9/15/09,A,Real Madrid,FC Zürich,2:05,CF,27,0:01,Direct free kick,No assist,International,UEFA,Stage,2009-09-15,2009,2:05,2,5,5,2,Normal,CF,27
2009/2010,UEFA Champions League,Group Stage,9/15/09,A,Real Madrid,FC Zürich,2:05,CF,89,2:04,Direct free kick,No assist,International,UEFA,Stage,2009-09-15,2009,2:05,2,5,5,2,Normal,CF,89
2009/2010,LaLiga,3,9/20/09,H,Real Madrid,Xerez CD,5:00,RW,1,1:00,Right-footed shot,No assist,National Leagues,Spanish Football Federation (RFEF),Matchday,2009-09-20,2009,5:00,5,0,5,0,Normal,RW,1
2009/2010,LaLiga,3,9/20/09,H,Real Madrid,Xerez CD,5:00,RW,75,2:00,Header,Esteban Granero,National Leagues,Spanish Football Federation (RFEF),Matchday,2009-09-20,2009,5:00,5,0,5,0,Normal,RW,75
2009/2010,LaLiga,4,9/23/09,A,Real Madrid,Villarreal CF,0:02,CF,2,0:01,Right-footed shot,No assist,National Leagues,Spanish Football Federation (RFEF),Matchday,2009-09-23,2009,0:02,0,2,2,0,Normal,CF,2
2009/2010,UEFA Champions League,Group Stage,9/30/09,H,Real Madrid,Olympique Marseille,3:00,CF,58,1:00,Left-footed shot,Pepe,International,UEFA,Stage,2009-09-30,2009,3:00,3,0,3,0,Normal,CF,58
2009/2010,UEFA Champions League,Group Stage,9/30/09,H,Real Madrid,Olympique Marseille,3:00,CF,64,3:00,Right-footed shot,Karim Benzema,International,UEFA,Stage,2009-09-30,2009,3:00,3,0,3,0,Normal,CF,64
2009/2010,LaLiga,13,12-05-09,H,Real Madrid,UD Almeria,4:02,CF,84,4:02,Right-footed shot,Gonzalo Higuain,National Leagues,Spanish Football Federation (RFEF),Matchday,2009-12-05,2009,4:02,4,2,4,2,Normal,CF,84
2009/2010,UEFA Champions League,Group Stage,12-08-09,A,Real Madrid,Olympique Marseille,1:03,CF,5,0:01,Direct free kick,No assist,International,UEFA,Stage,2009-12-08,2009,1:03,1,3,3,1,Normal,CF,5
2009/2010,UEFA Champions League,Group Stage,12-08-09,A,Real Madrid,Olympique Marseille,1:03,CF,80,1:03,Right-footed shot,Lassana Diarra,International,UEFA,Stage,2009-12-08,2009,1:03,1,3,3,1,Normal,CF,80
2009/2010,LaLiga,15,12/19/09,H,Real Madrid,Real Zaragoza,6:00,CF,50,5:00,Left-footed shot,Ezequiel Garay,National Leagues,Spanish Football Federation (RFEF),Matchday,2009-12-19,2009,6:00,6,0,6,0,Normal,CF,50
2009/2010,LaLiga,19,1/24/10,H,Real Madrid,Malaga CF,2:00,RW,35,1:00,Right-footed shot,Kaka,National Leagues,Spanish Football Federation (RFEF),Matchday,2010-01-24,2010,2:00,2,0,2,0,Normal,RW,35
2009/2010,LaLiga,19,1/24/10,H,Real Madrid,Malaga CF,2:00,RW,39,2:00,Right-footed shot,Guti,National Leagues,Spanish Football Federation (RFEF),Matchday,2010-01-24,2010,2:00,2,0,2,0,Normal,RW,39
2009/2010,LaLiga,22,2/13/10,A,Real Madrid,Xerez CD,0:03,,69,0:02,Header,Kaka,National Leagues,Spanish Football Federation (RFEF),Matchday,2010-02-13,2010,0:03,0,3,3,0,Normal,LW,69
2009/2010,LaLiga,22,2/13/10,A,Real Madrid,Xerez CD,0:03,,71,0:03,Left-footed shot,Kaka,National Leagues,Spanish Football Federation (RFEF),Matchday,2010-02-13,2010,0:03,0,3,3,0,Normal,LW,71
2009/2010,LaLiga,23,2/21/10,H,Real Madrid,Villarreal CF,6:02,,18,1:00,Direct free kick,No assist,National Leagues,Spanish Football Federation (RFEF),Matchday,2010-02-21,2010,6:02,6,2,6,2,Normal,LW,18
2009/2010,LaLiga,24,2/27/10,A,Real Madrid,CD Tenerife,1:05,,78,1:04,Penalty,No assist,National Leagues,Spanish Football Federation (RFEF),Matchday,2010-02-27,2010,1:05,1,5,5,1,Normal,LW,78
2009/2010,LaLiga,25,03-06-10,H,Real Madrid,Sevilla FC,3:02,CF,59,1:02,Left-footed shot,No assist,National Leagues,Spanish Football Federation (RFEF),Matchday,2010-03-06,2010,3:02,3,2,3,2,Normal,CF,59
2009/2010,UEFA Champions League,Last 16,03-10-10,H,Real Madrid,Olympique Lyon,1:01,LW,6,1:00,Left-footed shot,Guti,International,UEFA,Stage,2010-03-10,2010,1:01,1,1,1,1,Normal,LW,6
2009/2010,LaLiga,26,3/14/10,A,Real Madrid,Real Valladolid CF,1:04,CF,29,0:01,Direct free kick,No assist,National Leagues,Spanish Football Federation (RFEF),Matchday,2010-03-14,2010,1:04,1,4,4,1,Normal,CF,29
2009/2010,LaLiga,28,3/25/10,A,Real Madrid,Getafe CF,2:04,,13,0:01,Direct free kick,No assist,National Leagues,Spanish Football Federation (RFEF),Matchday,2010-03-25,2010,2:04,2,4,4,2,Normal,LW,13
2009/2010,LaLiga,28,3/25/10,A,Real Madrid,Getafe CF,2:04,,36,0:04,Right-footed shot,No assist,National Leagues,Spanish Football Federation (RFEF),Matchday,2010-03-25,2010,2:04,2,4,4,2,Normal,LW,36
2009/2010,LaLiga,30,04-04-10,A,Real Madrid,Racing Santander,0:02,,23,0:01,Penalty,No assist,National Leagues,Spanish Football Federation (RFEF),Matchday,2010-04-04,2010,0:02,0,2,2,0,Normal,LW,23
2009/2010,LaLiga,32,4/15/10,A,Real Madrid,UD Almeria,1:02,,26,1:01,Left-footed shot,No assist,National Leagues,Spanish Football Federation (RFEF),Matchday,2010-04-15,2010,1:02,1,2,2,1,Normal,LW,26
2009/2010,LaLiga,33,4/18/10,H,Real Madrid,Valencia CF,2:00,CF,77,2:00,Right-footed shot,Marcelo,National Leagues,Spanish Football Federation (RFEF),Matchday,2010-04-18,2010,2:00,2,0,2,0,Normal,CF,77
2009/2010,LaLiga,35,05-02-10,H,Real Madrid,CA Osasuna,3:02,,25,1:01,Right-footed shot,No assist,National Leagues,Spanish Football Federation (RFEF),Matchday,2010-05-02,2010,3:02,3,2,3,2,Normal,LW,25
2009/2010,LaLiga,35,05-02-10,H,Real Madrid,CA Osasuna,3:02,,89,3:02,Header,Gonzalo Higuain,National Leagues,Spanish Football Federation (RFEF),Matchday,2010-05-02,2010,3:02,3,2,3,2,Normal,LW,89
2009/2010,LaLiga,36,05-05-10,A,Real Madrid,RCD Mallorca,1:04,,26,1:01,Right-footed shot,Sergio Ramos,National Leagues,Spanish Football Federation (RFEF),Matchday,2010-05-05,2010,1:04,1,4,4,1,Normal,LW,26
2009/2010,LaLiga,36,05-05-10,A,Real Madrid,RCD Mallorca,1:04,,56,1:02,Right-footed shot,Sergio Ramos,National Leagues,Spanish Football Federation (RFEF),Matchday,2010-05-05,2010,1:04,1,4,4,1,Normal,LW,56
2009/2010,LaLiga,36,05-05-10,A,Real Madrid,RCD Mallorca,1:04,,71,1:03,Right-footed shot,No assist,National Leagues,Spanish Football Federation (RFEF),Matchday,2010-05-05,2010,1:04,1,4,4,1,Normal,LW,71
2009/2010,LaLiga,37,05-08-10,H,Real Madrid,Athletic Bilbao,5:01,CF,21,1:00,Penalty,No assist,National Leagues,Spanish Football Federation (RFEF),Matchday,2010-05-08,2010,5:01,5,1,5,1,Normal,CF,21
2010/2011,LaLiga,4,9/21/10,H,Real Madrid,RCD Espanyol Barcelona,3:00,LW,28,1:00,Penalty,No assist,National Leagues,Spanish Football Federation (RFEF),Matchday,2010-09-21,2010,3:00,3,0,3,0,Normal,LW,28
2010/2011,LaLiga,6,10-03-10,H,Real Madrid,Deportivo de La Coruña,6:01,LW,4,1:00,Header,Mesut Ozil,National Leagues,Spanish Football Federation (RFEF),Matchday,2010-10-03,2010,6:01,6,1,6,1,Normal,LW,4
2010/2011,LaLiga,6,10-03-10,H,Real Madrid,Deportivo de La Coruña,6:01,LW,89,6:01,Left-footed shot,Xabi Alonso,National Leagues,Spanish Football Federation (RFEF),Matchday,2010-10-03,2010,6:01,6,1,6,1,Normal,LW,89
2010/2011,LaLiga,7,10/16/10,A,Real Madrid,Malaga CF,1:04,LW,45,0:02,Right-footed shot,Mesut Ozil,National Leagues,Spanish Football Federation (RFEF),Matchday,2010-10-16,2010,1:04,1,4,4,1,Normal,LW,45
2010/2011,LaLiga,7,10/16/10,A,Real Madrid,Malaga CF,1:04,LW,50,0:03,Penalty,No assist,National Leagues,Spanish Football Federation (RFEF),Matchday,2010-10-16,2010,1:04,1,4,4,1,Normal,LW,50
2010/2011,UEFA Champions League,Group Stage,10/19/10,H,Real Madrid,AC Milan,2:00,LW,13,1:00,Direct free kick,No assist,International,UEFA,Stage,2010-10-19,2010,2:00,2,0,2,0,Normal,LW,13
2010/2011,LaLiga,8,10/23/10,H,Real Madrid,Racing Santander,6:01,LW,15,2:00,Right-footed shot,Gonzalo Higuain,National Leagues,Spanish Football Federation (RFEF),Matchday,2010-10-23,2010,6:01,6,1,6,1,Normal,LW,15
2010/2011,LaLiga,8,10/23/10,H,Real Madrid,Racing Santander,6:01,LW,26,3:00,Left-footed shot,Mesut Ozil,National Leagues,Spanish Football Federation (RFEF),Matchday,2010-10-23,2010,6:01,6,1,6,1,Normal,LW,26
2010/2011,LaLiga,8,10/23/10,H,Real Madrid,Racing Santander,6:01,LW,47,4:00,Right-footed shot,Angel Di Maria,National Leagues,Spanish Football Federation (RFEF),Matchday,2010-10-23,2010,6:01,6,1,6,1,Normal,LW,47
2010/2011,LaLiga,8,10/23/10,H,Real Madrid,Racing Santander,6:01,LW,55,5:00,Penalty,No assist,National Leagues,Spanish Football Federation (RFEF),Matchday,2010-10-23,2010,6:01,6,1,6,1,Normal,LW,55
2010/2011,LaLiga,9,10/30/10,A,Real Madrid,Hercules CF,1:03,LW,82,1:02,Right-footed shot,Karim Benzema,National Leagues,Spanish Football Federation (RFEF),Matchday,2010-10-30,2010,1:03,1,3,3,1,Normal,LW,82
2010/2011,LaLiga,9,10/30/10,A,Real Madrid,Hercules CF,1:03,LW,86,1:03,Right-footed shot,Karim Benzema,National Leagues,Spanish Football Federation (RFEF),Matchday,2010-10-30,2010,1:03,1,3,3,1,Normal,LW,86
2010/2011,Copa del Rey,Round 4,11-10-10,H,Real Madrid,Real Murcia CF,5:01,,76,3:00,Left-footed shot,Angel Di Maria,National Cups,Spanish Football Federation (RFEF),Stage,2010-11-10,2010,5:01,5,1,5,1,Normal,LW,76
2010/2011,LaLiga,12,11/20/10,H,Real Madrid,Athletic Bilbao,5:01,LW,30,2:00,Left-footed shot,Mesut Ozil,National Leagues,Spanish Football Federation (RFEF),Matchday,2010-11-20,2010,5:01,5,1,5,1,Normal,LW,30
2010/2011,LaLiga,12,11/20/10,H,Real Madrid,Athletic Bilbao,5:01,LW,62,4:01,Direct free kick,No assist,National Leagues,Spanish Football Federation (RFEF),Matchday,2010-11-20,2010,5:01,5,1,5,1,Normal,LW,62
2010/2011,LaLiga,12,11/20/10,H,Real Madrid,Athletic Bilbao,5:01,LW,90+1,5:01,Penalty,No assist,National Leagues,Spanish Football Federation (RFEF),Matchday,2010-11-20,2010,5:01,5,1,5,1,Normal,LW,91
2010/2011,UEFA Champions League,Group Stage,11/23/10,A,Real Madrid,Ajax Amsterdam,0:04,LW,70,0:03,Left-footed shot,Angel Di Maria,International,UEFA,Stage,2010-11-23,2010,0:04,0,4,4,0,Normal,LW,70
2010/2011,UEFA Champions League,Group Stage,11/23/10,A,Real Madrid,Ajax Amsterdam,0:04,LW,81,0:04,Penalty,No assist,International,UEFA,Stage,2010-11-23,2010,0:04,0,4,4,0,Normal,LW,81
2010/2011,LaLiga,14,12-04-10,H,Real Madrid,Valencia CF,2:00,LW,72,1:00,Left-footed shot,Mesut Ozil,National Leagues,Spanish Football Federation (RFEF),Matchday,2010-12-04,2010,2:00,2,0,2,0,Normal,LW,72
2010/2011,LaLiga,14,12-04-10,H,Real Madrid,Valencia CF,2:00,LW,86,2:00,Right-footed shot,No assist,National Leagues,Spanish Football Federation (RFEF),Matchday,2010-12-04,2010,2:00,2,0,2,0,Normal,LW,86
2010/2011,UEFA Champions League,Group Stage,12-08-10,H,Real Madrid,AJ Auxerre,4:00,LW,49,2:00,Right-footed shot,Marcelo,International,UEFA,Stage,2010-12-08,2010,4:00,4,0,4,0,Normal,LW,49
2010/2011,LaLiga,15,12-12-10,A,Real Madrid,Real Zaragoza,1:03,LW,43,0:02,Direct free kick,No assist,National Leagues,Spanish Football Federation (RFEF),Matchday,2010-12-12,2010,1:03,1,3,3,1,Normal,LW,43
2010/2011,Copa del Rey,Last 16,12/22/10,H,Real Madrid,Levante UD,8:00,LW,44,4:00,Right-footed shot,Karim Benzema,National Cups,Spanish Football Federation (RFEF),Stage,2010-12-22,2010,8:00,8,0,8,0,Normal,LW,44
2010/2011,Copa del Rey,Last 16,12/22/10,H,Real Madrid,Levante UD,8:00,LW,71,6:00,Right-footed shot,Angel Di Maria,National Cups,Spanish Football Federation (RFEF),Stage,2010-12-22,2010,8:00,8,0,8,0,Normal,LW,71
2010/2011,Copa del Rey,Last 16,12/22/10,H,Real Madrid,Levante UD,8:00,LW,73,7:00,Right-footed shot,Karim Benzema,National Cups,Spanish Football Federation (RFEF),Stage,2010-12-22,2010,8:00,8,0,8,0,Normal,LW,73
2010/2011,LaLiga,17,01-03-11,A,Real Madrid,Getafe CF,2:03,LW,11,0:01,Penalty,No assist,National Leagues,Spanish Football Federation (RFEF),Matchday,2011-01-03,2011,2:03,2,3,3,2,Normal,LW,11
2010/2011,LaLiga,17,01-03-11,A,Real Madrid,Getafe CF,2:03,LW,57,1:03,Right-footed shot,Karim Benzema,National Leagues,Spanish Football Federation (RFEF),Matchday,2011-01-03,2011,2:03,2,3,3,2,Normal,LW,57
2010/2011,LaLiga,18,01-09-11,H,Real Madrid,Villarreal CF,4:02,LW,10,1:01,Right-footed shot,Mesut Ozil,National Leagues,Spanish Football Federation (RFEF),Matchday,2011-01-09,2011,4:02,4,2,4,2,Normal,LW,10
2010/2011,LaLiga,18,01-09-11,H,Real Madrid,Villarreal CF,4:02,LW,45,2:02,Header,Xabi Alonso,National Leagues,Spanish Football Federation (RFEF),Matchday,2011-01-09,2011,4:02,4,2,4,2,Normal,LW,45
2010/2011,LaLiga,18,01-09-11,H,Real Madrid,Villarreal CF,4:02,LW,79,3:02,Left-footed shot,Kaka,National Leagues,Spanish Football Federation (RFEF),Matchday,2011-01-09,2011,4:02,4,2,4,2,Normal,LW,79
2010/2011,Copa del Rey,Quarter-Finals,1/13/11,H,Real Madrid,Atletico de Madrid,3:01,LW,60,2:01,Right-footed shot,Mesut Ozil,National Cups,Spanish Football Federation (RFEF),Stage,2011-01-13,2011,3:01,3,1,3,1,Normal,LW,60
2010/2011,Copa del Rey,Quarter-Finals,1/20/11,A,Real Madrid,Atletico de Madrid,0:01,CF,22,0:01,Right-footed shot,Sergio Ramos,National Cups,Spanish Football Federation (RFEF),Stage,2011-01-20,2011,0:01,0,1,1,0,Normal,CF,22
2010/2011,LaLiga,22,02-06-11,H,Real Madrid,Real Sociedad,4:01,LW,20,2:00,Left-footed shot,Kaka,National Leagues,Spanish Football Federation (RFEF),Matchday,2011-02-06,2011,4:01,4,1,4,1,Normal,LW,20
2010/2011,LaLiga,22,02-06-11,H,Real Madrid,Real Sociedad,4:01,LW,42,3:00,Header,Mesut Ozil,National Leagues,Spanish Football Federation (RFEF),Matchday,2011-02-06,2011,4:01,4,1,4,1,Normal,LW,42
2010/2011,LaLiga,26,03-03-11,H,Real Madrid,Malaga CF,7:00,LW,50,4:00,Left-footed shot,Mesut Ozil,National Leagues,Spanish Football Federation (RFEF),Matchday,2011-03-03,2011,7:00,7,0,7,0,Normal,LW,50
2010/2011,LaLiga,26,03-03-11,H,Real Madrid,Malaga CF,7:00,LW,67,6:00,Penalty,No assist,National Leagues,Spanish Football Federation (RFEF),Matchday,2011-03-03,2011,7:00,7,0,7,0,Normal,LW,67
2010/2011,LaLiga,26,03-03-11,H,Real Madrid,Malaga CF,7:00,LW,76,7:00,Right-footed shot,Sergio Canales,National Leagues,Spanish Football Federation (RFEF),Matchday,2011-03-03,2011,7:00,7,0,7,0,Normal,LW,76
2010/2011,UEFA Champions League,Quarter-Finals,04-05-11,H,Real Madrid,Tottenham Hotspur,4:00,LW,87,4:00,Right-footed shot,Kaka,International,UEFA,Stage,2011-04-05,2011,4:00,4,0,4,0,Normal,LW,87
2010/2011,LaLiga,31,04-09-11,A,Real Madrid,Athletic Bilbao,0:03,CF,70,0:03,Right-footed shot,Esteban Granero,National Leagues,Spanish Football Federation (RFEF),Matchday,2011-04-09,2011,0:03,0,3,3,0,Normal,CF,70
2010/2011,UEFA Champions League,Quarter-Finals,4/13/11,A,Real Madrid,Tottenham Hotspur,0:01,RW,50,0:01,Right-footed shot,Sami Khedira,International,UEFA,Stage,2011-04-13,2011,0:01,0,1,1,0,Normal,RW,50
2010/2011,LaLiga,32,4/16/11,H,Real Madrid,FC Barcelona,1:01,LW,82,1:01,Penalty,No assist,National Leagues,Spanish Football Federation (RFEF),Matchday,2011-04-16,2011,1:01,1,1,1,1,Normal,LW,82
2010/2011,Copa del Rey,Final,4/20/11,A,Real Madrid,FC Barcelona,0:1 AET,CF,103,0:01,Header,Angel Di Maria,National Cups,Spanish Football Federation (RFEF),Stage,2011-04-20,2011,0:1,0,1,1,0,After Extra Time,CF,103
2010/2011,LaLiga,35,05-07-11,A,Real Madrid,Sevilla FC,2:06,LW,30,0:02,Right-footed shot,Pepe,National Leagues,Spanish Football Federation (RFEF),Matchday,2011-05-07,2011,2:06,2,6,6,2,Normal,LW,30
2010/2011,LaLiga,35,05-07-11,A,Real Madrid,Sevilla FC,2:06,LW,64,1:04,Right-footed shot,No assist,National Leagues,Spanish Football Federation (RFEF),Matchday,2011-05-07,2011,2:06,2,6,6,2,Normal,LW,64
2010/2011,LaLiga,35,05-07-11,A,Real Madrid,Sevilla FC,2:06,LW,70,1:05,Right-footed shot,Mesut Ozil,National Leagues,Spanish Football Federation (RFEF),Matchday,2011-05-07,2011,2:06,2,6,6,2,Normal,LW,70
2010/2011,LaLiga,35,05-07-11,A,Real Madrid,Sevilla FC,2:06,LW,76,1:06,Right-footed shot,Karim Benzema,National Leagues,Spanish Football Federation (RFEF),Matchday,2011-05-07,2011,2:06,2,6,6,2,Normal,LW,76
2010/2011,LaLiga,36,05-10-11,H,Real Madrid,Getafe CF,4:00,LW,23,1:00,Header,Mesut Ozil,National Leagues,Spanish Football Federation (RFEF),Matchday,2011-05-10,2011,4:00,4,0,4,0,Normal,LW,23
2010/2011,LaLiga,36,05-10-11,H,Real Madrid,Getafe CF,4:00,LW,57,2:00,Left-footed shot,Mesut Ozil,National Leagues,Spanish Football Federation (RFEF),Matchday,2011-05-10,2011,4:00,4,0,4,0,Normal,LW,57
2010/2011,LaLiga,36,05-10-11,H,Real Madrid,Getafe CF,4:00,LW,90+1,4:00,Penalty,No assist,National Leagues,Spanish Football Federation (RFEF),Matchday,2011-05-10,2011,4:00,4,0,4,0,Normal,LW,91
2010/2011,LaLiga,37,5/15/11,A,Real Madrid,Villarreal CF,1:03,CF,22,0:02,Direct free kick,No assist,National Leagues,Spanish Football Federation (RFEF),Matchday,2011-05-15,2011,1:03,1,3,3,1,Normal,CF,22
2010/2011,LaLiga,37,5/15/11,A,Real Madrid,Villarreal CF,1:03,CF,90,1:03,Direct free kick,No assist,National Leagues,Spanish Football Federation (RFEF),Matchday,2011-05-15,2011,1:03,1,3,3,1,Normal,CF,90
2010/2011,LaLiga,38,5/21/11,H,Real Madrid,UD Almeria,8:01,LW,4,1:00,Right-footed shot,Sergio Ramos,National Leagues,Spanish Football Federation (RFEF),Matchday,2011-05-21,2011,8:01,8,1,8,1,Normal,LW,4
2010/2011,LaLiga,38,5/21/11,H,Real Madrid,UD Almeria,8:01,LW,76,7:01,Right-footed shot,Sergio Ramos,National Leagues,Spanish Football Federation (RFEF),Matchday,2011-05-21,2011,8:01,8,1,8,1,Normal,LW,76
2011/2012,Supercopa,Final,8/17/11,A,Real Madrid,FC Barcelona,3:02,LW,20,1:01,Right-footed shot,Karim Benzema,National SuperCups,Spanish Football Federation (RFEF),Stage,2011-08-17,2011,3:02,3,2,2,3,Normal,LW,20
2011/2012,LaLiga,2,8/28/11,A,Real Madrid,Real Zaragoza,0:06,LW,23,0:01,Left-footed shot,Mesut Ozil,National Leagues,Spanish Football Federation (RFEF),Matchday,2011-08-28,2011,0:06,0,6,6,0,Normal,LW,23
2011/2012,LaLiga,2,8/28/11,A,Real Madrid,Real Zaragoza,0:06,LW,70,0:04,Right-footed shot,Angel Di Maria,National Leagues,Spanish Football Federation (RFEF),Matchday,2011-08-28,2011,0:06,0,6,6,0,Normal,LW,70
2011/2012,LaLiga,2,8/28/11,A,Real Madrid,Real Zaragoza,0:06,LW,86,0:06,Right-footed shot,Kaka,National Leagues,Spanish Football Federation (RFEF),Matchday,2011-08-28,2011,0:06,0,6,6,0,Normal,LW,86
2011/2012,LaLiga,3,09-10-11,H,Real Madrid,Getafe CF,4:02,LW,59,2:01,Penalty,No assist,National Leagues,Spanish Football Federation (RFEF),Matchday,2011-09-10,2011,4:02,4,2,4,2,Normal,LW,59
2011/2012,LaLiga,6,9/24/11,H,Real Madrid,Rayo Vallecano,6:02,LW,39,1:01,Left-footed shot,Kaka,National Leagues,Spanish Football Federation (RFEF),Matchday,2011-09-24,2011,6:02,6,2,6,2,Normal,LW,39
2011/2012,LaLiga,6,9/24/11,H,Real Madrid,Rayo Vallecano,6:02,LW,51,3:01,Penalty,No assist,National Leagues,Spanish Football Federation (RFEF),Matchday,2011-09-24,2011,6:02,6,2,6,2,Normal,LW,51
2011/2012,LaLiga,6,9/24/11,H,Real Madrid,Rayo Vallecano,6:02,LW,84,6:02,Penalty,No assist,National Leagues,Spanish Football Federation (RFEF),Matchday,2011-09-24,2011,6:02,6,2,6,2,Normal,LW,84
2011/2012,UEFA Champions League,Group Stage,9/27/11,H,Real Madrid,Ajax Amsterdam,3:00,LW,25,1:00,Right-footed shot,Karim Benzema,International,UEFA,Stage,2011-09-27,2011,3:00,3,0,3,0,Normal,LW,25
2011/2012,LaLiga,9,10/22/11,A,Real Madrid,Malaga CF,0:04,LW,24,0:02,Left-footed shot,Angel Di Maria,National Leagues,Spanish Football Federation (RFEF),Matchday,2011-10-22,2011,0:04,0,4,4,0,Normal,LW,24
2011/2012,LaLiga,9,10/22/11,A,Real Madrid,Malaga CF,0:04,LW,28,0:03,Right-footed shot,Xabi Alonso,National Leagues,Spanish Football Federation (RFEF),Matchday,2011-10-22,2011,0:04,0,4,4,0,Normal,LW,28
2011/2012,LaLiga,9,10/22/11,A,Real Madrid,Malaga CF,0:04,LW,38,0:04,Right-footed shot,Sergio Ramos,National Leagues,Spanish Football Federation (RFEF),Matchday,2011-10-22,2011,0:04,0,4,4,0,Normal,LW,38
2011/2012,UEFA Champions League,Group Stage,11-02-11,A,Real Madrid,Olympique Lyon,0:02,LW,25,0:01,Direct free kick,No assist,International,UEFA,Stage,2011-11-02,2011,0:02,0,2,2,0,Normal,LW,25
2011/2012,UEFA Champions League,Group Stage,11-02-11,A,Real Madrid,Olympique Lyon,0:02,LW,69,0:02,Penalty,No assist,International,UEFA,Stage,2011-11-02,2011,0:02,0,2,2,0,Normal,LW,69
2011/2012,LaLiga,12,11-06-11,H,Real Madrid,CA Osasuna,7:01,LW,23,1:00,Header,Angel Di Maria,National Leagues,Spanish Football Federation (RFEF),Matchday,2011-11-06,2011,7:01,7,1,7,1,Normal,LW,23
2011/2012,LaLiga,12,11-06-11,H,Real Madrid,CA Osasuna,7:01,LW,55,4:01,Penalty,No assist,National Leagues,Spanish Football Federation (RFEF),Matchday,2011-11-06,2011,7:01,7,1,7,1,Normal,LW,55
2011/2012,LaLiga,12,11-06-11,H,Real Madrid,CA Osasuna,7:01,LW,58,5:01,Header,alvaro Arbeloa,National Leagues,Spanish Football Federation (RFEF),Matchday,2011-11-06,2011,7:01,7,1,7,1,Normal,LW,58
2011/2012,LaLiga,13,11/19/11,A,Real Madrid,Valencia CF,2:03,LW,79,1:03,Right-footed shot,Pepe,National Leagues,Spanish Football Federation (RFEF),Matchday,2011-11-19,2011,2:03,2,3,3,2,Normal,LW,79
2011/2012,LaLiga,14,11/26/11,H,Real Madrid,Atletico de Madrid,4:01,LW,24,1:01,Penalty,No assist,National Leagues,Spanish Football Federation (RFEF),Matchday,2011-11-26,2011,4:01,4,1,4,1,Normal,LW,24
2011/2012,LaLiga,14,11/26/11,H,Real Madrid,Atletico de Madrid,4:01,LW,82,4:01,Penalty,No assist,National Leagues,Spanish Football Federation (RFEF),Matchday,2011-11-26,2011,4:01,4,1,4,1,Normal,LW,82
2011/2012,LaLiga,15,12-03-11,A,Real Madrid,Sporting Gijón,0:03,LW,65,0:02,Right-footed shot,Angel Di Maria,National Leagues,Spanish Football Federation (RFEF),Matchday,2011-12-03,2011,0:03,0,3,3,0,Normal,LW,65
2011/2012,Copa del Rey,Round 4,12/13/11,A,Real Madrid,SD Ponferradina,0:02,LW,74,0:02,Left-footed shot,Gonzalo Higuain,National Cups,Spanish Football Federation (RFEF),Stage,2011-12-13,2011,0:02,0,2,2,0,Normal,LW,74
2011/2012,LaLiga,17,12/17/11,A,Real Madrid,Sevilla FC,2:06,LW,10,0:01,Right-footed shot,Angel Di Maria,National Leagues,Spanish Football Federation (RFEF),Matchday,2011-12-17,2011,2:06,2,6,6,2,Normal,LW,10
2011/2012,LaLiga,17,12/17/11,A,Real Madrid,Sevilla FC,2:06,LW,41,0:03,Right-footed shot,Karim Benzema,National Leagues,Spanish Football Federation (RFEF),Matchday,2011-12-17,2011,2:06,2,6,6,2,Normal,LW,41
2011/2012,LaLiga,17,12/17/11,A,Real Madrid,Sevilla FC,2:06,LW,86,1:05,Penalty,No assist,National Leagues,Spanish Football Federation (RFEF),Matchday,2011-12-17,2011,2:06,2,6,6,2,Normal,LW,86
2011/2012,LaLiga,18,01-07-12,H,Real Madrid,Granada CF,5:01,LW,89,5:01,Right-footed shot,No assist,National Leagues,Spanish Football Federation (RFEF),Matchday,2012-01-07,2012,5:01,5,1,5,1,Normal,LW,89
2011/2012,Copa del Rey,Quarter-Finals,1/18/12,H,Real Madrid,FC Barcelona,1:02,LW,11,1:00,Left-footed shot,Karim Benzema,National Cups,Spanish Football Federation (RFEF),Stage,2012-01-18,2012,1:02,1,2,1,2,Normal,LW,11
2011/2012,LaLiga,1,1/22/12,H,Real Madrid,Athletic Bilbao,4:01,LW,46,2:01,Penalty,No assist,National Leagues,Spanish Football Federation (RFEF),Matchday,2012-01-22,2012,4:01,4,1,4,1,Normal,LW,46
2011/2012,LaLiga,1,1/22/12,H,Real Madrid,Athletic Bilbao,4:01,LW,67,3:01,Penalty,No assist,National Leagues,Spanish Football Federation (RFEF),Matchday,2012-01-22,2012,4:01,4,1,4,1,Normal,LW,67
2011/2012,Copa del Rey,Quarter-Finals,1/25/12,A,Real Madrid,FC Barcelona,2:02,LW,68,2:01,Right-footed shot,Mesut Ozil,National Cups,Spanish Football Federation (RFEF),Stage,2012-01-25,2012,2:02,2,2,2,2,Normal,LW,68
2011/2012,LaLiga,21,1/28/12,H,Real Madrid,Real Zaragoza,3:01,LW,48,2:01,Right-footed shot,Mesut Ozil,National Leagues,Spanish Football Federation (RFEF),Matchday,2012-01-28,2012,3:01,3,1,3,1,Normal,LW,48
2011/2012,LaLiga,23,02-12-12,H,Real Madrid,Levante UD,4:02,LW,45,1:01,Penalty,No assist,National Leagues,Spanish Football Federation (RFEF),Matchday,2012-02-12,2012,4:02,4,2,4,2,Normal,LW,45
2011/2012,LaLiga,23,02-12-12,H,Real Madrid,Levante UD,4:02,LW,50,2:01,Header,Gonzalo Higuain,National Leagues,Spanish Football Federation (RFEF),Matchday,2012-02-12,2012,4:02,4,2,4,2,Normal,LW,50
2011/2012,LaLiga,23,02-12-12,H,Real Madrid,Levante UD,4:02,LW,57,3:01,Right-footed shot,Fabio Coentrão,National Leagues,Spanish Football Federation (RFEF),Matchday,2012-02-12,2012,4:02,4,2,4,2,Normal,LW,57
2011/2012,LaLiga,24,2/18/12,H,Real Madrid,Racing Santander,4:00,LW,6,1:00,Header,Kaka,National Leagues,Spanish Football Federation (RFEF),Matchday,2012-02-18,2012,4:00,4,0,4,0,Normal,LW,6
2011/2012,UEFA Champions League,Last 16,2/21/12,A,Real Madrid,CSKA Moscow,1:01,LW,28,0:01,Left-footed shot,Fabio Coentrão,International,UEFA,Stage,2012-02-21,2012,1:01,1,1,1,1,Normal,LW,28
2011/2012,LaLiga,25,2/26/12,A,Real Madrid,Rayo Vallecano,0:01,LW,53,0:01,Right-footed shot,No assist,National Leagues,Spanish Football Federation (RFEF),Matchday,2012-02-26,2012,0:01,0,1,1,0,Normal,LW,53
2011/2012,LaLiga,26,03-04-12,H,Real Madrid,RCD Espanyol Barcelona,5:00,LW,23,1:00,Left-footed shot,Gonzalo Higuain,National Leagues,Spanish Football Federation (RFEF),Matchday,2012-03-04,2012,5:00,5,0,5,0,Normal,LW,23
2011/2012,LaLiga,27,03-10-12,A,Real Madrid,Real Betis Balompie,2:03,LW,52,1:02,Left-footed shot,Marcelo,National Leagues,Spanish Football Federation (RFEF),Matchday,2012-03-10,2012,2:03,2,3,3,2,Normal,LW,52
2011/2012,LaLiga,27,03-10-12,A,Real Madrid,Real Betis Balompie,2:03,LW,73,2:03,Left-footed shot,No assist,National Leagues,Spanish Football Federation (RFEF),Matchday,2012-03-10,2012,2:03,2,3,3,2,Normal,LW,73
2011/2012,UEFA Champions League,Last 16,3/14/12,H,Real Madrid,CSKA Moscow,4:01,LW,55,2:00,Right-footed shot,Sergio Ramos,International,UEFA,Stage,2012-03-14,2012,4:01,4,1,4,1,Normal,LW,55
2011/2012,UEFA Champions League,Last 16,3/14/12,H,Real Madrid,CSKA Moscow,4:01,LW,90+4,4:01,Right-footed shot,Karim Benzema,International,UEFA,Stage,2012-03-14,2012,4:01,4,1,4,1,Normal,LW,94
2011/2012,LaLiga,29,3/21/12,A,Real Madrid,Villarreal CF,1:01,LW,61,0:01,Right-footed shot,Mesut Ozil,National Leagues,Spanish Football Federation (RFEF),Matchday,2012-03-21,2012,1:01,1,1,1,1,Normal,LW,61
2011/2012,LaLiga,30,3/24/12,H,Real Madrid,Real Sociedad,5:01,LW,32,2:00,Right-footed shot,Kaka,National Leagues,Spanish Football Federation (RFEF),Matchday,2012-03-24,2012,5:01,5,1,5,1,Normal,LW,32
2011/2012,LaLiga,30,3/24/12,H,Real Madrid,Real Sociedad,5:01,LW,55,5:01,Right-footed shot,Gonzalo Higuain,National Leagues,Spanish Football Federation (RFEF),Matchday,2012-03-24,2012,5:01,5,1,5,1,Normal,LW,55
2011/2012,LaLiga,31,3/31/12,A,Real Madrid,CA Osasuna,1:05,LW,37,0:02,Long distance kick,Xabi Alonso,National Leagues,Spanish Football Federation (RFEF),Matchday,2012-03-31,2012,1:05,1,5,5,1,Normal,LW,37
2011/2012,LaLiga,31,3/31/12,A,Real Madrid,CA Osasuna,1:05,LW,70,1:04,Direct free kick,No assist,National Leagues,Spanish Football Federation (RFEF),Matchday,2012-03-31,2012,1:05,1,5,5,1,Normal,LW,70
2011/2012,UEFA Champions League,Quarter-Finals,04-04-12,H,Real Madrid,APOEL Nicosia,5:02,LW,26,1:00,Right-footed shot,Marcelo,International,UEFA,Stage,2012-04-04,2012,5:02,5,2,5,2,Normal,LW,26
2011/2012,UEFA Champions League,Quarter-Finals,04-04-12,H,Real Madrid,APOEL Nicosia,5:02,LW,75,3:01,Direct free kick,No assist,International,UEFA,Stage,2012-04-04,2012,5:02,5,2,5,2,Normal,LW,75
2011/2012,LaLiga,33,04-11-12,A,Real Madrid,Atletico de Madrid,1:04,LW,24,0:01,Direct free kick,No assist,National Leagues,Spanish Football Federation (RFEF),Matchday,2012-04-11,2012,1:04,1,4,4,1,Normal,LW,24
2011/2012,LaLiga,33,04-11-12,A,Real Madrid,Atletico de Madrid,1:04,LW,67,1:02,Long distance kick,No assist,National Leagues,Spanish Football Federation (RFEF),Matchday,2012-04-11,2012,1:04,1,4,4,1,Normal,LW,67
2011/2012,LaLiga,33,04-11-12,A,Real Madrid,Atletico de Madrid,1:04,LW,82,1:03,Penalty,No assist,National Leagues,Spanish Football Federation (RFEF),Matchday,2012-04-11,2012,1:04,1,4,4,1,Normal,LW,82
2011/2012,LaLiga,34,4/14/12,H,Real Madrid,Sporting Gijón,3:01,LW,74,2:01,Header,Angel Di Maria,National Leagues,Spanish Football Federation (RFEF),Matchday,2012-04-14,2012,3:01,3,1,3,1,Normal,LW,74
2011/2012,LaLiga,35,4/21/12,A,Real Madrid,FC Barcelona,1:02,LW,73,1:02,Right-footed shot,Mesut Ozil,National Leagues,Spanish Football Federation (RFEF),Matchday,2012-04-21,2012,1:02,1,2,2,1,Normal,LW,73
2011/2012,UEFA Champions League,Semi-Finals,4/25/12,H,Real Madrid,Bayern Munich,3:4 on pens,LW,6,1:00,Penalty,No assist,International,UEFA,Stage,2012-04-25,2012,3:4,3,4,3,4,Penalties,LW,6
2011/2012,UEFA Champions League,Semi-Finals,4/25/12,H,Real Madrid,Bayern Munich,3:4 on pens,LW,14,2:00,Right-footed shot,Mesut Ozil,International,UEFA,Stage,2012-04-25,2012,3:4,3,4,3,4,Penalties,LW,14
2011/2012,LaLiga,36,4/29/12,H,Real Madrid,Sevilla FC,3:00,LW,19,1:00,Right-footed shot,Karim Benzema,National Leagues,Spanish Football Federation (RFEF),Matchday,2012-04-29,2012,3:00,3,0,3,0,Normal,LW,19
2011/2012,LaLiga,20,05-02-12,A,Real Madrid,Athletic Bilbao,0:03,LW,49,0:03,Header,Xabi Alonso,National Leagues,Spanish Football Federation (RFEF),Matchday,2012-05-02,2012,0:03,0,3,3,0,Normal,LW,49
2011/2012,LaLiga,37,05-05-12,A,Real Madrid,Granada CF,1:02,LW,81,1:01,Penalty,No assist,National Leagues,Spanish Football Federation (RFEF),Matchday,2012-05-05,2012,1:02,1,2,2,1,Normal,LW,81
2011/2012,LaLiga,38,5/13/12,H,Real Madrid,RCD Mallorca,4:01,LW,18,1:00,Header,Marcelo,National Leagues,Spanish Football Federation (RFEF),Matchday,2012-05-13,2012,4:01,4,1,4,1,Normal,LW,18
2012/2013,Supercopa,Final,8/23/12,A,Real Madrid,FC Barcelona,3:02,LW,55,0:01,Header,Mesut Ozil,National SuperCups,Spanish Football Federation (RFEF),Stage,2012-08-23,2012,3:02,3,2,2,3,Normal,LW,55
2012/2013,Supercopa,Final,8/29/12,H,Real Madrid,FC Barcelona,2:01,LW,19,2:00,Right-footed shot,Sami Khedira,National SuperCups,Spanish Football Federation (RFEF),Stage,2012-08-29,2012,2:01,2,1,2,1,Normal,LW,19
2012/2013,LaLiga,3,09-02-12,H,Real Madrid,Granada CF,3:00,LW,25,1:00,Right-footed shot,Jose Callejón,National Leagues,Spanish Football Federation (RFEF),Matchday,2012-09-02,2012,3:00,3,0,3,0,Normal,LW,25
2012/2013,LaLiga,3,09-02-12,H,Real Madrid,Granada CF,3:00,LW,53,2:00,Left-footed shot,No assist,National Leagues,Spanish Football Federation (RFEF),Matchday,2012-09-02,2012,3:00,3,0,3,0,Normal,LW,53
2012/2013,UEFA Champions League,Group Stage,9/18/12,H,Real Madrid,Manchester City,3:02,LW,90,3:02,Right-footed shot,Marcelo,International,UEFA,Stage,2012-09-18,2012,3:02,3,2,3,2,Normal,LW,90
2012/2013,LaLiga,5,9/24/12,A,Real Madrid,Rayo Vallecano,0:02,LW,69,0:02,Penalty,No assist,National Leagues,Spanish Football Federation (RFEF),Matchday,2012-09-24,2012,0:02,0,2,2,0,Normal,LW,69
2012/2013,LaLiga,6,9/30/12,H,Real Madrid,Deportivo de La Coruña,5:01,LW,23,1:01,Penalty,No assist,National Leagues,Spanish Football Federation (RFEF),Matchday,2012-09-30,2012,5:01,5,1,5,1,Normal,LW,23
2012/2013,LaLiga,6,9/30/12,H,Real Madrid,Deportivo de La Coruña,5:01,LW,44,3:01,Header,Sergio Ramos,National Leagues,Spanish Football Federation (RFEF),Matchday,2012-09-30,2012,5:01,5,1,5,1,Normal,LW,44
2012/2013,LaLiga,6,9/30/12,H,Real Madrid,Deportivo de La Coruña,5:01,LW,84,5:01,Penalty,No assist,National Leagues,Spanish Football Federation (RFEF),Matchday,2012-09-30,2012,5:01,5,1,5,1,Normal,LW,84
2012/2013,UEFA Champions League,Group Stage,10-03-12,A,Real Madrid,Ajax Amsterdam,1:04,LW,42,0:01,Right-footed shot,Karim Benzema,International,UEFA,Stage,2012-10-03,2012,1:04,1,4,4,1,Normal,LW,42
2012/2013,UEFA Champions League,Group Stage,10-03-12,A,Real Madrid,Ajax Amsterdam,1:04,LW,79,1:03,Right-footed shot,Karim Benzema,International,UEFA,Stage,2012-10-03,2012,1:04,1,4,4,1,Normal,LW,79
2012/2013,UEFA Champions League,Group Stage,10-03-12,A,Real Madrid,Ajax Amsterdam,1:04,LW,81,1:04,Left-footed shot,Sami Khedira,International,UEFA,Stage,2012-10-03,2012,1:04,1,4,4,1,Normal,LW,81
2012/2013,LaLiga,7,10-07-12,A,Real Madrid,FC Barcelona,2:02,LW,22,0:01,Left-footed shot,Karim Benzema,National Leagues,Spanish Football Federation (RFEF),Matchday,2012-10-07,2012,2:02,2,2,2,2,Normal,LW,22
2012/2013,LaLiga,7,10-07-12,A,Real Madrid,FC Barcelona,2:02,LW,66,2:02,Right-footed shot,Mesut Ozil,National Leagues,Spanish Football Federation (RFEF),Matchday,2012-10-07,2012,2:02,2,2,2,2,Normal,LW,66
2012/2013,LaLiga,8,10/20/12,H,Real Madrid,Celta de Vigo,2:00,LW,67,2:00,Penalty,No assist,National Leagues,Spanish Football Federation (RFEF),Matchday,2012-10-20,2012,2:00,2,0,2,0,Normal,LW,67
2012/2013,UEFA Champions League,Group Stage,10/24/12,A,Real Madrid,Borussia Dortmund,2:01,LW,38,1:01,Right-footed shot,Mesut Ozil,International,UEFA,Stage,2012-10-24,2012,2:01,2,1,1,2,Normal,LW,38
2012/2013,LaLiga,9,10/28/12,A,Real Madrid,RCD Mallorca,0:05,LW,22,0:02,Right-footed shot,Gonzalo Higuain,National Leagues,Spanish Football Federation (RFEF),Matchday,2012-10-28,2012,0:05,0,5,5,0,Normal,LW,22
2012/2013,LaLiga,9,10/28/12,A,Real Madrid,RCD Mallorca,0:05,LW,73,0:04,Right-footed shot,Gonzalo Higuain,National Leagues,Spanish Football Federation (RFEF),Matchday,2012-10-28,2012,0:05,0,5,5,0,Normal,LW,73
2012/2013,LaLiga,11,11-11-12,A,Real Madrid,Levante UD,1:02,CF,20,0:01,Right-footed shot,No assist,National Leagues,Spanish Football Federation (RFEF),Matchday,2012-11-11,2012,1:02,1,2,2,1,Normal,CF,20
2012/2013,LaLiga,14,12-01-12,H,Real Madrid,Atletico de Madrid,2:00,LW,16,1:00,Direct free kick,No assist,National Leagues,Spanish Football Federation (RFEF),Matchday,2012-12-01,2012,2:00,2,0,2,0,Normal,LW,16
2012/2013,UEFA Champions League,Group Stage,12-04-12,H,Real Madrid,Ajax Amsterdam,4:01,LW,13,1:00,Right-footed shot,Karim Benzema,International,UEFA,Stage,2012-12-04,2012,4:01,4,1,4,1,Normal,LW,13
2012/2013,Copa del Rey,Last 16,12-12-12,A,Real Madrid,Celta de Vigo,2:01,LW,87,2:01,Left-footed shot,Xabi Alonso,National Cups,Spanish Football Federation (RFEF),Stage,2012-12-12,2012,2:01,2,1,1,2,Normal,LW,87
2012/2013,LaLiga,16,12/16/12,H,Real Madrid,RCD Espanyol Barcelona,2:02,CF,45,1:01,Right-footed shot,Sami Khedira,National Leagues,Spanish Football Federation (RFEF),Matchday,2012-12-16,2012,2:02,2,2,2,2,Normal,CF,45
2012/2013,LaLiga,18,01-06-13,H,Real Madrid,Real Sociedad,4:03,LW ,67,3:02,Left-footed shot,Karim Benzema,National Leagues,Spanish Football Federation (RFEF),Matchday,2013-01-06,2013,4:03,4,3,4,3,Normal,LW,67
2012/2013,LaLiga,18,01-06-13,H,Real Madrid,Real Sociedad,4:03,LW ,70,4:02,Direct free kick,No assist,National Leagues,Spanish Football Federation (RFEF),Matchday,2013-01-06,2013,4:03,4,3,4,3,Normal,LW,70
2012/2013,Copa del Rey,Last 16,01-09-13,H,Real Madrid,Celta de Vigo,4:00,LW,2,1:00,Right-footed shot,alvaro Arbeloa,National Cups,Spanish Football Federation (RFEF),Stage,2013-01-09,2013,4:00,4,0,4,0,Normal,LW,2
2012/2013,Copa del Rey,Last 16,01-09-13,H,Real Madrid,Celta de Vigo,4:00,LW,24,2:00,Left-footed shot,Luka Modric,National Cups,Spanish Football Federation (RFEF),Stage,2013-01-09,2013,4:00,4,0,4,0,Normal,LW,24
2012/2013,Copa del Rey,Last 16,01-09-13,H,Real Madrid,Celta de Vigo,4:00,LW,87,3:00,Left-footed shot,Gonzalo Higuain,National Cups,Spanish Football Federation (RFEF),Stage,2013-01-09,2013,4:00,4,0,4,0,Normal,LW,87
2012/2013,LaLiga,20,1/20/13,A,Real Madrid,Valencia CF,0:05,LW,35,0:03,Left-footed shot,Fabio Coentrão,National Leagues,Spanish Football Federation (RFEF),Matchday,2013-01-20,2013,0:05,0,5,5,0,Normal,LW,35
2012/2013,LaLiga,20,1/20/13,A,Real Madrid,Valencia CF,0:05,LW,41,0:04,Right-footed shot,Mesut Ozil,National Leagues,Spanish Football Federation (RFEF),Matchday,2013-01-20,2013,0:05,0,5,5,0,Normal,LW,41
2012/2013,LaLiga,21,1/27/13,H,Real Madrid,Getafe CF,4:00,LW,62,2:00,Left-footed shot,Mesut Ozil,National Leagues,Spanish Football Federation (RFEF),Matchday,2013-01-27,2013,4:00,4,0,4,0,Normal,LW,62
2012/2013,LaLiga,21,1/27/13,H,Real Madrid,Getafe CF,4:00,LW,65,3:00,Header,Angel Di Maria,National Leagues,Spanish Football Federation (RFEF),Matchday,2013-01-27,2013,4:00,4,0,4,0,Normal,LW,65
2012/2013,LaLiga,21,1/27/13,H,Real Madrid,Getafe CF,4:00,LW,72,4:00,Penalty,No assist,National Leagues,Spanish Football Federation (RFEF),Matchday,2013-01-27,2013,4:00,4,0,4,0,Normal,LW,72
2012/2013,LaLiga,23,02-09-13,H,Real Madrid,Sevilla FC,4:01,LW,26,2:00,Left-footed shot,Kaka,National Leagues,Spanish Football Federation (RFEF),Matchday,2013-02-09,2013,4:01,4,1,4,1,Normal,LW,26
2012/2013,LaLiga,23,02-09-13,H,Real Madrid,Sevilla FC,4:01,LW,46,3:00,Left-footed shot,alvaro Arbeloa,National Leagues,Spanish Football Federation (RFEF),Matchday,2013-02-09,2013,4:01,4,1,4,1,Normal,LW,46
2012/2013,LaLiga,23,02-09-13,H,Real Madrid,Sevilla FC,4:01,LW,59,4:00,Right-footed shot,Gonzalo Higuain,National Leagues,Spanish Football Federation (RFEF),Matchday,2013-02-09,2013,4:01,4,1,4,1,Normal,LW,59
2012/2013,UEFA Champions League,Last 16,2/13/13,H,Real Madrid,Manchester United,1:01,LW,30,1:01,Header,Angel Di Maria,International,UEFA,Stage,2013-02-13,2013,1:01,1,1,1,1,Normal,LW,30
2012/2013,Copa del Rey,Semi-Finals,2/26/13,A,Real Madrid,FC Barcelona,1:03,LW,12,0:01,Penalty,No assist,National Cups,Spanish Football Federation (RFEF),Stage,2013-02-26,2013,1:03,1,3,3,1,Normal,LW,12
2012/2013,Copa del Rey,Semi-Finals,2/26/13,A,Real Madrid,FC Barcelona,1:03,LW,57,0:02,Left-footed shot,No assist,National Cups,Spanish Football Federation (RFEF),Stage,2013-02-26,2013,1:03,1,3,3,1,Normal,LW,57
2012/2013,UEFA Champions League,Last 16,03-05-13,A,Real Madrid,Manchester United,1:02,LW,69,1:02,Right-footed shot,Gonzalo Higuain,International,UEFA,Stage,2013-03-05,2013,1:02,1,2,2,1,Normal,LW,69
2012/2013,LaLiga,27,03-10-13,A,Real Madrid,Celta de Vigo,1:02,LW,61,0:01,Left-footed shot,Jose Callejón,National Leagues,Spanish Football Federation (RFEF),Matchday,2013-03-10,2013,1:02,1,2,2,1,Normal,LW,61
2012/2013,LaLiga,27,03-10-13,A,Real Madrid,Celta de Vigo,1:02,LW,71,1:02,Penalty,No assist,National Leagues,Spanish Football Federation (RFEF),Matchday,2013-03-10,2013,1:02,1,2,2,1,Normal,LW,71
2012/2013,LaLiga,28,3/16/13,H,Real Madrid,RCD Mallorca,5:02,LW,52,2:02,Header,Mesut Ozil,National Leagues,Spanish Football Federation (RFEF),Matchday,2013-03-16,2013,5:02,5,2,5,2,Normal,LW,52
2012/2013,LaLiga,29,3/30/13,A,Real Madrid,Real Zaragoza,1:01,LW,38,1:01,Long distance kick,No assist,National Leagues,Spanish Football Federation (RFEF),Matchday,2013-03-30,2013,1:01,1,1,1,1,Normal,LW,38
2012/2013,UEFA Champions League,Quarter-Finals,04-03-13,H,Real Madrid,Galatasaray,3:00,LW,9,1:00,Left-footed shot,Mesut Ozil,International,UEFA,Stage,2013-04-03,2013,3:00,3,0,3,0,Normal,LW,9
2012/2013,LaLiga,30,04-06-13,H,Real Madrid,Levante UD,5:01,CF,84,3:01,Right-footed shot,Gonzalo Higuain,National Leagues,Spanish Football Federation (RFEF),Matchday,2013-04-06,2013,5:01,5,1,5,1,Normal,CF,84
2012/2013,UEFA Champions League,Quarter-Finals,04-09-13,A,Real Madrid,Galatasaray,3:02,LW,8,0:01,Right-footed shot,Sami Khedira,International,UEFA,Stage,2013-04-09,2013,3:02,3,2,2,3,Normal,LW,8
2012/2013,UEFA Champions League,Quarter-Finals,04-09-13,A,Real Madrid,Galatasaray,3:02,LW,90+2,3:02,Right-footed shot,Karim Benzema,International,UEFA,Stage,2013-04-09,2013,3:02,3,2,2,3,Normal,LW,92
2012/2013,LaLiga,31,4/14/13,A,Real Madrid,Athletic Bilbao,0:03,LW,2,0:01,Direct free kick,No assist,National Leagues,Spanish Football Federation (RFEF),Matchday,2013-04-14,2013,0:03,0,3,3,0,Normal,LW,2
2012/2013,LaLiga,31,4/14/13,A,Real Madrid,Athletic Bilbao,0:03,LW,68,0:02,Header,Xabi Alonso,National Leagues,Spanish Football Federation (RFEF),Matchday,2013-04-14,2013,0:03,0,3,3,0,Normal,LW,68
2012/2013,UEFA Champions League,Semi-Finals,4/24/13,A,Real Madrid,Borussia Dortmund,4:01,LW,43,1:01,Right-footed shot,Gonzalo Higuain,International,UEFA,Stage,2013-04-24,2013,4:01,4,1,1,4,Normal,LW,43
2012/2013,LaLiga,34,05-04-13,H,Real Madrid,Real Valladolid CF,4:03,LW,32,2:01,Header,Angel Di Maria,National Leagues,Spanish Football Federation (RFEF),Matchday,2013-05-04,2013,4:03,4,3,4,3,Normal,LW,32
2012/2013,LaLiga,34,05-04-13,H,Real Madrid,Real Valladolid CF,4:03,LW,70,4:02,Header,Mesut Ozil,National Leagues,Spanish Football Federation (RFEF),Matchday,2013-05-04,2013,4:03,4,3,4,3,Normal,LW,70
2012/2013,LaLiga,36,05-08-13,H,Real Madrid,Malaga CF,6:02,LW ,26,2:01,Right-footed shot,Xabi Alonso,National Leagues,Spanish Football Federation (RFEF),Matchday,2013-05-08,2013,6:02,6,2,6,2,Normal,LW,26
2012/2013,Copa del Rey,Final,5/17/13,A,Real Madrid,Atletico de Madrid,2:1 AET,LW,14,0:01,Header,Luka Modric,National Cups,Spanish Football Federation (RFEF),Stage,2013-05-17,2013,2:1,2,1,1,2,After Extra Time,LW,14
2013/2014,LaLiga,3,09-01-13,H,Real Madrid,Athletic Bilbao,3:01,LW,45,2:00,Header,Angel Di Maria,National Leagues,Spanish Football Federation (RFEF),Matchday,2013-09-01,2013,3:01,3,1,3,1,Normal,LW,45
2013/2014,LaLiga,4,9/14/13,A,Real Madrid,Villarreal CF,2:02,LW,64,1:02,Right-footed shot,No assist,National Leagues,Spanish Football Federation (RFEF),Matchday,2013-09-14,2013,2:02,2,2,2,2,Normal,LW,64
2013/2014,UEFA Champions League,Group Stage,9/17/13,A,Real Madrid,Galatasaray,1:06,LW,63,0:03,Left-footed shot,Isco,International,UEFA,Stage,2013-09-17,2013,1:06,1,6,6,1,Normal,LW,63
2013/2014,UEFA Champions League,Group Stage,9/17/13,A,Real Madrid,Galatasaray,1:06,LW,66,0:04,Tap-in,Sergio Ramos,International,UEFA,Stage,2013-09-17,2013,1:06,1,6,6,1,Normal,LW,66
2013/2014,UEFA Champions League,Group Stage,9/17/13,A,Real Madrid,Galatasaray,1:06,LW,90,1:06,Left-footed shot,Karim Benzema,International,UEFA,Stage,2013-09-17,2013,1:06,1,6,6,1,Normal,LW,90
2013/2014,LaLiga,5,9/22/13,H,Real Madrid,Getafe CF,4:01,LW,34,2:01,Penalty,No assist,National Leagues,Spanish Football Federation (RFEF),Matchday,2013-09-22,2013,4:01,4,1,4,1,Normal,LW,34
2013/2014,LaLiga,5,9/22/13,H,Real Madrid,Getafe CF,4:01,LW,90,4:01,Right-footed shot,Sami Khedira,National Leagues,Spanish Football Federation (RFEF),Matchday,2013-09-22,2013,4:01,4,1,4,1,Normal,LW,90
2013/2014,LaLiga,6,9/25/13,A,Real Madrid,Elche CF,1:02,LW,51,0:01,Direct free kick,No assist,National Leagues,Spanish Football Federation (RFEF),Matchday,2013-09-25,2013,1:02,1,2,2,1,Normal,LW,51
2013/2014,LaLiga,6,9/25/13,A,Real Madrid,Elche CF,1:02,LW,90+6,1:02,Penalty,No assist,National Leagues,Spanish Football Federation (RFEF),Matchday,2013-09-25,2013,1:02,1,2,2,1,Normal,LW,96
2013/2014,UEFA Champions League,Group Stage,10-02-13,H,Real Madrid,FC Copenhagen,4:00,LW,21,1:00,Header,Marcelo,International,UEFA,Stage,2013-10-02,2013,4:00,4,0,4,0,Normal,LW,21
2013/2014,UEFA Champions League,Group Stage,10-02-13,H,Real Madrid,FC Copenhagen,4:00,LW,65,2:00,Header,Angel Di Maria,International,UEFA,Stage,2013-10-02,2013,4:00,4,0,4,0,Normal,LW,65
2013/2014,LaLiga,8,10-05-13,A,Real Madrid,Levante UD,2:03,LW,90+4,2:03,Right-footed shot,Luka Modric,National Leagues,Spanish Football Federation (RFEF),Matchday,2013-10-05,2013,2:03,2,3,3,2,Normal,LW,94
2013/2014,LaLiga,9,10/19/13,H,Real Madrid,Malaga CF,2:00,LW,90+1,2:00,Penalty,No assist,National Leagues,Spanish Football Federation (RFEF),Matchday,2013-10-19,2013,2:00,2,0,2,0,Normal,LW,91
2013/2014,UEFA Champions League,Group Stage,10/23/13,H,Real Madrid,Juventus FC,2:01,LW,4,1:00,Right-footed shot,Angel Di Maria,International,UEFA,Stage,2013-10-23,2013,2:01,2,1,2,1,Normal,LW,4
2013/2014,UEFA Champions League,Group Stage,10/23/13,H,Real Madrid,Juventus FC,2:01,LW,29,2:01,Penalty,No assist,International,UEFA,Stage,2013-10-23,2013,2:01,2,1,2,1,Normal,LW,29
2013/2014,LaLiga,11,10/30/13,H,Real Madrid,Sevilla FC,7:03,LW,31,3:00,Penalty,No assist,National Leagues,Spanish Football Federation (RFEF),Matchday,2013-10-30,2013,7:03,7,3,7,3,Normal,LW,31
2013/2014,LaLiga,11,10/30/13,H,Real Madrid,Sevilla FC,7:03,LW,60,5:02,Right-footed shot,Gareth Bale,National Leagues,Spanish Football Federation (RFEF),Matchday,2013-10-30,2013,7:03,7,3,7,3,Normal,LW,60
2013/2014,LaLiga,11,10/30/13,H,Real Madrid,Sevilla FC,7:03,LW,71,6:03,Right-footed shot,Karim Benzema,National Leagues,Spanish Football Federation (RFEF),Matchday,2013-10-30,2013,7:03,7,3,7,3,Normal,LW,71
2013/2014,LaLiga,12,11-02-13,A,Real Madrid,Rayo Vallecano,2:03,LW,3,0:01,Right-footed shot,Luka Modric,National Leagues,Spanish Football Federation (RFEF),Matchday,2013-11-02,2013,2:03,2,3,3,2,Normal,LW,3
2013/2014,LaLiga,12,11-02-13,A,Real Madrid,Rayo Vallecano,2:03,LW,48,0:03,Right-footed shot,Gareth Bale,National Leagues,Spanish Football Federation (RFEF),Matchday,2013-11-02,2013,2:03,2,3,3,2,Normal,LW,48
2013/2014,UEFA Champions League,Group Stage,11-05-13,A,Real Madrid,Juventus FC,2:02,LW,52,1:01,Right-footed shot,Karim Benzema,International,UEFA,Stage,2013-11-05,2013,2:02,2,2,2,2,Normal,LW,52
2013/2014,LaLiga,13,11-09-13,H,Real Madrid,Real Sociedad,5:01,LW,12,1:00,Right-footed shot,Karim Benzema,National Leagues,Spanish Football Federation (RFEF),Matchday,2013-11-09,2013,5:01,5,1,5,1,Normal,LW,12
2013/2014,LaLiga,13,11-09-13,H,Real Madrid,Real Sociedad,5:01,LW,27,3:00,Penalty,No assist,National Leagues,Spanish Football Federation (RFEF),Matchday,2013-11-09,2013,5:01,5,1,5,1,Normal,LW,27
2013/2014,LaLiga,13,11-09-13,H,Real Madrid,Real Sociedad,5:01,LW,76,5:01,Direct free kick,No assist,National Leagues,Spanish Football Federation (RFEF),Matchday,2013-11-09,2013,5:01,5,1,5,1,Normal,LW,76
2013/2014,LaLiga,14,11/23/13,A,Real Madrid,UD Almeria,0:05,LW,3,0:01,Left-footed shot,Isco,National Leagues,Spanish Football Federation (RFEF),Matchday,2013-11-23,2013,0:05,0,5,5,0,Normal,LW,3
2013/2014,UEFA Champions League,Group Stage,12-10-13,A,Real Madrid,FC Copenhagen,0:02,LW,48,0:02,Right-footed shot,Pepe,International,UEFA,Stage,2013-12-10,2013,0:02,0,2,2,0,Normal,LW,48
2013/2014,LaLiga,17,12/22/13,A,Real Madrid,Valencia CF,2:03,LW,40,1:02,Header,Angel Di Maria,National Leagues,Spanish Football Federation (RFEF),Matchday,2013-12-22,2013,2:03,2,3,3,2,Normal,LW,40
2013/2014,LaLiga,18,01-06-14,H,Real Madrid,Celta de Vigo,3:00,LW,82,2:00,Right-footed shot,Daniel Carvajal,National Leagues,Spanish Football Federation (RFEF),Matchday,2014-01-06,2014,3:00,3,0,3,0,Normal,LW,82
2013/2014,LaLiga,18,01-06-14,H,Real Madrid,Celta de Vigo,3:00,LW,90,3:00,Right-footed shot,Gareth Bale,National Leagues,Spanish Football Federation (RFEF),Matchday,2014-01-06,2014,3:00,3,0,3,0,Normal,LW,90
2013/2014,Copa del Rey,Last 16,1/15/14,A,Real Madrid,CA Osasuna,0:02,LW,22,0:01,Direct free kick,No assist,National Cups,Spanish Football Federation (RFEF),Stage,2014-01-15,2014,0:02,0,2,2,0,Normal,LW,22
2013/2014,LaLiga,20,1/18/14,A,Real Madrid,Real Betis Balompie,0:05,LW,10,0:01,Right-footed shot,Angel Di Maria,National Leagues,Spanish Football Federation (RFEF),Matchday,2014-01-18,2014,0:05,0,5,5,0,Normal,LW,10
2013/2014,LaLiga,21,1/25/14,H,Real Madrid,Granada CF,2:00,LW,57,1:00,Right-footed shot,Luka Modric,National Leagues,Spanish Football Federation (RFEF),Matchday,2014-01-25,2014,2:00,2,0,2,0,Normal,LW,57
2013/2014,Copa del Rey,Semi-Finals,02-11-14,A,Real Madrid,Atletico de Madrid,0:02,LW,6,0:01,Penalty,No assist,National Cups,Spanish Football Federation (RFEF),Stage,2014-02-11,2014,0:02,0,2,2,0,Normal,LW,6
2013/2014,Copa del Rey,Semi-Finals,02-11-14,A,Real Madrid,Atletico de Madrid,0:02,LW,15,0:02,Penalty,No assist,National Cups,Spanish Football Federation (RFEF),Stage,2014-02-11,2014,0:02,0,2,2,0,Normal,LW,15
2013/2014,UEFA Champions League,Last 16,2/26/14,A,Real Madrid,FC Schalke 04,1:06,LW,52,0:03,Left-footed shot,Gareth Bale,International,UEFA,Stage,2014-02-26,2014,1:06,1,6,6,1,Normal,LW,52
2013/2014,UEFA Champions League,Last 16,2/26/14,A,Real Madrid,FC Schalke 04,1:06,LW,89,0:06,Right-footed shot,Karim Benzema,International,UEFA,Stage,2014-02-26,2014,1:06,1,6,6,1,Normal,LW,89
2013/2014,LaLiga,26,03-02-14,A,Real Madrid,Atletico de Madrid,2:02,LW,82,2:02,Right-footed shot,Gareth Bale,National Leagues,Spanish Football Federation (RFEF),Matchday,2014-03-02,2014,2:02,2,2,2,2,Normal,LW,82
2013/2014,LaLiga,27,03-09-14,H,Real Madrid,Levante UD,3:00,LW,11,1:00,Header,Angel Di Maria,National Leagues,Spanish Football Federation (RFEF),Matchday,2014-03-09,2014,3:00,3,0,3,0,Normal,LW,11
2013/2014,LaLiga,28,3/15/14,A,Real Madrid,Malaga CF,0:01,LW,23,0:01,Right-footed shot,Gareth Bale,National Leagues,Spanish Football Federation (RFEF),Matchday,2014-03-15,2014,0:01,0,1,1,0,Normal,LW,23
2013/2014,UEFA Champions League,Last 16,3/18/14,H,Real Madrid,FC Schalke 04,3:01,LW,22,1:00,Right-footed shot,Gareth Bale,International,UEFA,Stage,2014-03-18,2014,3:01,3,1,3,1,Normal,LW,22
2013/2014,UEFA Champions League,Last 16,3/18/14,H,Real Madrid,FC Schalke 04,3:01,LW,74,2:01,Right-footed shot,No assist,International,UEFA,Stage,2014-03-18,2014,3:01,3,1,3,1,Normal,LW,74
2013/2014,LaLiga,29,3/23/14,H,Real Madrid,FC Barcelona,3:04,LW,55,3:02,Penalty,No assist,National Leagues,Spanish Football Federation (RFEF),Matchday,2014-03-23,2014,3:04,3,4,3,4,Normal,LW,55
2013/2014,LaLiga,30,3/26/14,A,Real Madrid,Sevilla FC,2:01,LW,14,0:01,Direct free kick,No assist,National Leagues,Spanish Football Federation (RFEF),Matchday,2014-03-26,2014,2:01,2,1,1,2,Normal,LW,14
2013/2014,LaLiga,31,3/29/14,H,Real Madrid,Rayo Vallecano,5:00,LW,15,1:00,Right-footed shot,Gareth Bale,National Leagues,Spanish Football Federation (RFEF),Matchday,2014-03-29,2014,5:00,5,0,5,0,Normal,LW,15
2013/2014,UEFA Champions League,Quarter-Finals,04-02-14,H,Real Madrid,Borussia Dortmund,3:00,LW,57,3:00,Left-footed shot,Luka Modric,International,UEFA,Stage,2014-04-02,2014,3:00,3,0,3,0,Normal,LW,57
2013/2014,LaLiga,35,4/26/14,H,Real Madrid,CA Osasuna,4:00,LW,6,1:00,Long distance kick,Angel Di Maria,National Leagues,Spanish Football Federation (RFEF),Matchday,2014-04-26,2014,4:00,4,0,4,0,Normal,LW,6
2013/2014,LaLiga,35,4/26/14,H,Real Madrid,CA Osasuna,4:00,LW,52,2:00,Long distance kick,Isco,National Leagues,Spanish Football Federation (RFEF),Matchday,2014-04-26,2014,4:00,4,0,4,0,Normal,LW,52
2013/2014,UEFA Champions League,Semi-Finals,4/29/14,A,Real Madrid,Bayern Munich,0:04,LW,34,0:03,Counter attack goal,Gareth Bale,International,UEFA,Stage,2014-04-29,2014,0:04,0,4,4,0,Normal,LW,34
2013/2014,UEFA Champions League,Semi-Finals,4/29/14,A,Real Madrid,Bayern Munich,0:04,LW,90,0:04,Direct free kick,No assist,International,UEFA,Stage,2014-04-29,2014,0:04,0,4,4,0,Normal,LW,90
2013/2014,LaLiga,36,05-04-14,H,Real Madrid,Valencia CF,2:02,LW,90,2:02,Right-footed shot,Angel Di Maria,National Leagues,Spanish Football Federation (RFEF),Matchday,2014-05-04,2014,2:02,2,2,2,2,Normal,LW,90
2013/2014,UEFA Champions League,Final,5/24/14,H,Real Madrid,Atletico de Madrid,4:1 AET,LW,120,4:01,Penalty,No assist,International,UEFA,Stage,2014-05-24,2014,4:1,4,1,4,1,After Extra Time,LW,120
2014/2015,UEFA Super Cup,Final,08-12-14,H,Real Madrid,Sevilla FC,2:00,LW,30,1:00,Right-footed shot,Gareth Bale,International,UEFA,Stage,2014-08-12,2014,2:00,2,0,2,0,Normal,LW,30
2014/2015,UEFA Super Cup,Final,08-12-14,H,Real Madrid,Sevilla FC,2:00,LW,49,2:00,Left-footed shot,Karim Benzema,International,UEFA,Stage,2014-08-12,2014,2:00,2,0,2,0,Normal,LW,49
2014/2015,LaLiga,1,8/25/14,H,Real Madrid,Córdoba CF,2:00,LW,90,2:00,Right-footed shot,Isco,National Leagues,Spanish Football Federation (RFEF),Matchday,2014-08-25,2014,2:00,2,0,2,0,Normal,LW,90
2014/2015,LaLiga,3,9/13/14,H,Real Madrid,Atletico de Madrid,1:02,LW,25,1:01,Penalty,No assist,National Leagues,Spanish Football Federation (RFEF),Matchday,2014-09-13,2014,1:02,1,2,1,2,Normal,LW,25
2014/2015,UEFA Champions League,Group Stage,9/16/14,H,Real Madrid,FC Basel 1893,5:01,LW,31,3:00,Right-footed shot,Gareth Bale,International,UEFA,Stage,2014-09-16,2014,5:01,5,1,5,1,Normal,LW,31
2014/2015,LaLiga,4,9/20/14,A,Real Madrid,Deportivo de La Coruña,2:08,RW,29,0:01,Header,alvaro Arbeloa,National Leagues,Spanish Football Federation (RFEF),Matchday,2014-09-20,2014,2:08,2,8,8,2,Normal,RW,29
2014/2015,LaLiga,4,9/20/14,A,Real Madrid,Deportivo de La Coruña,2:08,RW,41,0:03,Left-footed shot,Karim Benzema,National Leagues,Spanish Football Federation (RFEF),Matchday,2014-09-20,2014,2:08,2,8,8,2,Normal,RW,41
2014/2015,LaLiga,4,9/20/14,A,Real Madrid,Deportivo de La Coruña,2:08,RW,78,1:06,Left-footed shot,James Rodriguez,National Leagues,Spanish Football Federation (RFEF),Matchday,2014-09-20,2014,2:08,2,8,8,2,Normal,RW,78
2014/2015,LaLiga,5,9/23/14,H,Real Madrid,Elche CF,5:01,CF,28,2:01,Penalty,No assist,National Leagues,Spanish Football Federation (RFEF),Matchday,2014-09-23,2014,5:01,5,1,5,1,Normal,CF,28
2014/2015,LaLiga,5,9/23/14,H,Real Madrid,Elche CF,5:01,CF,32,3:01,Header,Marcelo,National Leagues,Spanish Football Federation (RFEF),Matchday,2014-09-23,2014,5:01,5,1,5,1,Normal,CF,32
2014/2015,LaLiga,5,9/23/14,H,Real Madrid,Elche CF,5:01,CF,80,4:01,Penalty,No assist,National Leagues,Spanish Football Federation (RFEF),Matchday,2014-09-23,2014,5:01,5,1,5,1,Normal,CF,80
2014/2015,LaLiga,5,9/23/14,H,Real Madrid,Elche CF,5:01,CF,90,5:01,Right-footed shot,Gareth Bale,National Leagues,Spanish Football Federation (RFEF),Matchday,2014-09-23,2014,5:01,5,1,5,1,Normal,CF,90
2014/2015,LaLiga,6,9/27/14,A,Real Madrid,Villarreal CF,0:02,CF,40,0:02,Right-footed shot,Karim Benzema,National Leagues,Spanish Football Federation (RFEF),Matchday,2014-09-27,2014,0:02,0,2,2,0,Normal,CF,40
2014/2015,UEFA Champions League,Group Stage,10-01-14,A,Real Madrid,Ludogorets Razgrad,1:02,CF,25,1:01,Penalty,No assist,International,UEFA,Stage,2014-10-01,2014,1:02,1,2,2,1,Normal,CF,25
2014/2015,LaLiga,7,10-05-14,H,Real Madrid,Athletic Bilbao,5:00,LW,3,1:00,Header,Gareth Bale,National Leagues,Spanish Football Federation (RFEF),Matchday,2014-10-05,2014,5:00,5,0,5,0,Normal,LW,3
2014/2015,LaLiga,7,10-05-14,H,Real Madrid,Athletic Bilbao,5:00,LW,55,3:00,Right-footed shot,Gareth Bale,National Leagues,Spanish Football Federation (RFEF),Matchday,2014-10-05,2014,5:00,5,0,5,0,Normal,LW,55
2014/2015,LaLiga,7,10-05-14,H,Real Madrid,Athletic Bilbao,5:00,LW,89,5:00,Deflected shot on goal,Pepe,National Leagues,Spanish Football Federation (RFEF),Matchday,2014-10-05,2014,5:00,5,0,5,0,Normal,LW,89
2014/2015,LaLiga,8,10/18/14,A,Real Madrid,Levante UD,0:05,CF,13,0:01,Penalty,No assist,National Leagues,Spanish Football Federation (RFEF),Matchday,2014-10-18,2014,0:05,0,5,5,0,Normal,CF,13
2014/2015,LaLiga,8,10/18/14,A,Real Madrid,Levante UD,0:05,CF,61,0:03,Right-footed shot,Isco,National Leagues,Spanish Football Federation (RFEF),Matchday,2014-10-18,2014,0:05,0,5,5,0,Normal,CF,61
2014/2015,UEFA Champions League,Group Stage,10/22/14,A,Real Madrid,Liverpool FC,0:03,CF,23,0:01,Right-footed shot,James Rodriguez,International,UEFA,Stage,2014-10-22,2014,0:03,0,3,3,0,Normal,CF,23
2014/2015,LaLiga,9,10/25/14,H,Real Madrid,FC Barcelona,3:01,CF,35,1:01,Penalty,No assist,National Leagues,Spanish Football Federation (RFEF),Matchday,2014-10-25,2014,3:01,3,1,3,1,Normal,CF,35
2014/2015,LaLiga,10,11-01-14,A,Real Madrid,Granada CF,0:04,CF,2,0:01,Right-footed shot,Karim Benzema,National Leagues,Spanish Football Federation (RFEF),Matchday,2014-11-01,2014,0:04,0,4,4,0,Normal,CF,2
2014/2015,LaLiga,11,11-08-14,H,Real Madrid,Rayo Vallecano,5:01,CF,83,5:01,Right-footed shot,Isco,National Leagues,Spanish Football Federation (RFEF),Matchday,2014-11-08,2014,5:01,5,1,5,1,Normal,CF,83
2014/2015,LaLiga,12,11/22/14,A,Real Madrid,SD Eibar,0:04,CF,43,0:02,Right-footed shot,Daniel Carvajal,National Leagues,Spanish Football Federation (RFEF),Matchday,2014-11-22,2014,0:04,0,4,4,0,Normal,CF,43
2014/2015,LaLiga,12,11/22/14,A,Real Madrid,SD Eibar,0:04,CF,83,0:04,Penalty,No assist,National Leagues,Spanish Football Federation (RFEF),Matchday,2014-11-22,2014,0:04,0,4,4,0,Normal,CF,83
2014/2015,UEFA Champions League,Group Stage,11/26/14,A,Real Madrid,FC Basel 1893,0:01,LW,35,0:01,Left-footed shot,Karim Benzema,International,UEFA,Stage,2014-11-26,2014,0:01,0,1,1,0,Normal,LW,35
2014/2015,LaLiga,14,12-06-14,H,Real Madrid,Celta de Vigo,3:00,CF,36,1:00,Penalty,No assist,National Leagues,Spanish Football Federation (RFEF),Matchday,2014-12-06,2014,3:00,3,0,3,0,Normal,CF,36
2014/2015,LaLiga,14,12-06-14,H,Real Madrid,Celta de Vigo,3:00,CF,65,2:00,Right-footed shot,No assist,National Leagues,Spanish Football Federation (RFEF),Matchday,2014-12-06,2014,3:00,3,0,3,0,Normal,CF,65
2014/2015,LaLiga,14,12-06-14,H,Real Madrid,Celta de Vigo,3:00,CF,81,3:00,Left-footed shot,Marcelo,National Leagues,Spanish Football Federation (RFEF),Matchday,2014-12-06,2014,3:00,3,0,3,0,Normal,CF,81
2014/2015,UEFA Champions League,Group Stage,12-09-14,H,Real Madrid,Ludogorets Razgrad,4:00,CF ,20,1:00,Penalty,No assist,International,UEFA,Stage,2014-12-09,2014,4:00,4,0,4,0,Normal,CF,20
2014/2015,LaLiga,15,12-12-14,A,Real Madrid,UD Almeria,1:04,CF,81,1:03,Right-footed shot,Karim Benzema,National Leagues,Spanish Football Federation (RFEF),Matchday,2014-12-12,2014,1:04,1,4,4,1,Normal,CF,81
2014/2015,LaLiga,15,12-12-14,A,Real Madrid,UD Almeria,1:04,CF,89,1:04,Right-footed shot,Daniel Carvajal,National Leagues,Spanish Football Federation (RFEF),Matchday,2014-12-12,2014,1:04,1,4,4,1,Normal,CF,89
2014/2015,LaLiga,17,01-04-15,A,Real Madrid,Valencia CF,2:01,LW,14,0:01,Penalty,No assist,National Leagues,Spanish Football Federation (RFEF),Matchday,2015-01-04,2015,2:01,2,1,1,2,Normal,LW,14
2014/2015,Copa del Rey,Last 16,1/15/15,H,Real Madrid,Atletico de Madrid,2:02,CF,54,2:02,Header,Gareth Bale,National Cups,Spanish Football Federation (RFEF),Stage,2015-01-15,2015,2:02,2,2,2,2,Normal,CF,54
2014/2015,LaLiga,19,1/18/15,A,Real Madrid,Getafe CF,0:03,LW,63,0:01,Left-footed shot,Karim Benzema,National Leagues,Spanish Football Federation (RFEF),Matchday,2015-01-18,2015,0:03,0,3,3,0,Normal,LW,63
2014/2015,LaLiga,19,1/18/15,A,Real Madrid,Getafe CF,0:03,LW,79,0:03,Header,James Rodriguez,National Leagues,Spanish Football Federation (RFEF),Matchday,2015-01-18,2015,0:03,0,3,3,0,Normal,LW,79
2014/2015,UEFA Champions League,Last 16,2/18/15,A,Real Madrid,FC Schalke 04,0:02,LW,26,0:01,Header,Daniel Carvajal,International,UEFA,Stage,2015-02-18,2015,0:02,0,2,2,0,Normal,LW,26
2014/2015,LaLiga,24,2/22/15,A,Real Madrid,Elche CF,0:02,CF,69,0:02,Header,Isco,National Leagues,Spanish Football Federation (RFEF),Matchday,2015-02-22,2015,0:02,0,2,2,0,Normal,CF,69
2014/2015,LaLiga,25,03-01-15,H,Real Madrid,Villarreal CF,1:01,CF,52,1:00,Penalty,No assist,National Leagues,Spanish Football Federation (RFEF),Matchday,2015-03-01,2015,1:01,1,1,1,1,Normal,CF,52
2014/2015,UEFA Champions League,Last 16,03-10-15,H,Real Madrid,FC Schalke 04,3:04,CF,25,1:01,Header,Toni Kroos,International,UEFA,Stage,2015-03-10,2015,3:04,3,4,3,4,Normal,CF,25
2014/2015,UEFA Champions League,Last 16,03-10-15,H,Real Madrid,FC Schalke 04,3:04,CF,45,2:02,Header,Fabio Coentrão,International,UEFA,Stage,2015-03-10,2015,3:04,3,4,3,4,Normal,CF,45
2014/2015,LaLiga,28,3/22/15,A,Real Madrid,FC Barcelona,2:01,LW,31,1:01,Right-footed shot,Karim Benzema,National Leagues,Spanish Football Federation (RFEF),Matchday,2015-03-22,2015,2:01,2,1,1,2,Normal,LW,31
2014/2015,LaLiga,29,04-05-15,H,Real Madrid,Granada CF,9:01,CF,30,2:00,Right-footed shot,James Rodriguez,National Leagues,Spanish Football Federation (RFEF),Matchday,2015-04-05,2015,9:01,9,1,9,1,Normal,CF,30
2014/2015,LaLiga,29,04-05-15,H,Real Madrid,Granada CF,9:01,CF,36,3:00,Right-footed shot,No assist,National Leagues,Spanish Football Federation (RFEF),Matchday,2015-04-05,2015,9:01,9,1,9,1,Normal,CF,36
2014/2015,LaLiga,29,04-05-15,H,Real Madrid,Granada CF,9:01,CF,38,4:00,Long distance kick,Gareth Bale,National Leagues,Spanish Football Federation (RFEF),Matchday,2015-04-05,2015,9:01,9,1,9,1,Normal,CF,38
2014/2015,LaLiga,29,04-05-15,H,Real Madrid,Granada CF,9:01,CF,54,6:00,Header,Gareth Bale,National Leagues,Spanish Football Federation (RFEF),Matchday,2015-04-05,2015,9:01,9,1,9,1,Normal,CF,54
2014/2015,LaLiga,29,04-05-15,H,Real Madrid,Granada CF,9:01,CF,90,9:01,Header,Luka Modric,National Leagues,Spanish Football Federation (RFEF),Matchday,2015-04-05,2015,9:01,9,1,9,1,Normal,CF,90
2014/2015,LaLiga,30,04-08-15,A,Real Madrid,Rayo Vallecano,0:02,LW,68,0:01,Header,Daniel Carvajal,National Leagues,Spanish Football Federation (RFEF),Matchday,2015-04-08,2015,0:02,0,2,2,0,Normal,LW,68
2014/2015,LaLiga,31,04-11-15,H,Real Madrid,SD Eibar,3:00,LW,21,1:00,Direct free kick,No assist,National Leagues,Spanish Football Federation (RFEF),Matchday,2015-04-11,2015,3:00,3,0,3,0,Normal,LW,21
2014/2015,LaLiga,32,4/18/15,H,Real Madrid,Malaga CF,3:01,CF,90+2,3:01,Left-footed shot,Chicharito,National Leagues,Spanish Football Federation (RFEF),Matchday,2015-04-18,2015,3:01,3,1,3,1,Normal,CF,92
2014/2015,LaLiga,35,05-02-15,A,Real Madrid,Sevilla FC,2:03,CF,36,0:01,Header,Isco,National Leagues,Spanish Football Federation (RFEF),Matchday,2015-05-02,2015,2:03,2,3,3,2,Normal,CF,36
2014/2015,LaLiga,35,05-02-15,A,Real Madrid,Sevilla FC,2:03,CF,37,0:02,Right-footed shot,Chicharito,National Leagues,Spanish Football Federation (RFEF),Matchday,2015-05-02,2015,2:03,2,3,3,2,Normal,CF,37
2014/2015,LaLiga,35,05-02-15,A,Real Madrid,Sevilla FC,2:03,CF,69,1:03,Header,Gareth Bale,National Leagues,Spanish Football Federation (RFEF),Matchday,2015-05-02,2015,2:03,2,3,3,2,Normal,CF,69
2014/2015,UEFA Champions League,Semi-Finals,05-05-15,A,Real Madrid,Juventus FC,2:01,CF,27,1:01,Header,James Rodriguez,International,UEFA,Stage,2015-05-05,2015,2:01,2,1,1,2,Normal,CF,27
2014/2015,UEFA Champions League,Semi-Finals,5/13/15,H,Real Madrid,Juventus FC,1:01,LW,23,1:00,Penalty,No assist,International,UEFA,Stage,2015-05-13,2015,1:01,1,1,1,1,Normal,LW,23
2014/2015,LaLiga,37,5/17/15,A,Real Madrid,RCD Espanyol Barcelona,1:04,LW,59,0:01,Left-footed shot,Karim Benzema,National Leagues,Spanish Football Federation (RFEF),Matchday,2015-05-17,2015,1:04,1,4,4,1,Normal,LW,59
2014/2015,LaLiga,37,5/17/15,A,Real Madrid,RCD Espanyol Barcelona,1:04,LW,83,1:03,Right-footed shot,Chicharito,National Leagues,Spanish Football Federation (RFEF),Matchday,2015-05-17,2015,1:04,1,4,4,1,Normal,LW,83
2014/2015,LaLiga,37,5/17/15,A,Real Madrid,RCD Espanyol Barcelona,1:04,LW,90+1,1:04,Header,James Rodriguez,National Leagues,Spanish Football Federation (RFEF),Matchday,2015-05-17,2015,1:04,1,4,4,1,Normal,LW,91
2014/2015,LaLiga,38,5/23/15,H,Real Madrid,Getafe CF,7:03,LW,13,1:00,Header,Marcelo,National Leagues,Spanish Football Federation (RFEF),Matchday,2015-05-23,2015,7:03,7,3,7,3,Normal,LW,13
2014/2015,LaLiga,38,5/23/15,H,Real Madrid,Getafe CF,7:03,LW,32,2:02,Direct free kick,No assist,National Leagues,Spanish Football Federation (RFEF),Matchday,2015-05-23,2015,7:03,7,3,7,3,Normal,LW,32
2014/2015,LaLiga,38,5/23/15,H,Real Madrid,Getafe CF,7:03,LW,34,3:02,Penalty,No assist,National Leagues,Spanish Football Federation (RFEF),Matchday,2015-05-23,2015,7:03,7,3,7,3,Normal,LW,34
2015/2016,LaLiga,3,09-12-15,A,Real Madrid,RCD Espanyol Barcelona,0:06,LW,7,0:01,Right-footed shot,Luka Modric,National Leagues,Spanish Football Federation (RFEF),Matchday,2015-09-12,2015,0:06,0,6,6,0,Normal,LW,7
2015/2016,LaLiga,3,09-12-15,A,Real Madrid,RCD Espanyol Barcelona,0:06,LW,17,0:02,Penalty,No assist,National Leagues,Spanish Football Federation (RFEF),Matchday,2015-09-12,2015,0:06,0,6,6,0,Normal,LW,17
2015/2016,LaLiga,3,09-12-15,A,Real Madrid,RCD Espanyol Barcelona,0:06,LW,20,0:03,Left-footed shot,Gareth Bale,National Leagues,Spanish Football Federation (RFEF),Matchday,2015-09-12,2015,0:06,0,6,6,0,Normal,LW,20
2015/2016,LaLiga,3,09-12-15,A,Real Madrid,RCD Espanyol Barcelona,0:06,LW,62,0:05,Right-footed shot,Gareth Bale,National Leagues,Spanish Football Federation (RFEF),Matchday,2015-09-12,2015,0:06,0,6,6,0,Normal,LW,62
2015/2016,LaLiga,3,09-12-15,A,Real Madrid,RCD Espanyol Barcelona,0:06,LW,81,0:06,Right-footed shot,Lucas Vazquez,National Leagues,Spanish Football Federation (RFEF),Matchday,2015-09-12,2015,0:06,0,6,6,0,Normal,LW,81
2015/2016,UEFA Champions League,Group Stage,9/15/15,H,Real Madrid,Shakhtar Donetsk,4:00,LW,56,2:00,Penalty,No assist,International,UEFA,Stage,2015-09-15,2015,4:00,4,0,4,0,Normal,LW,56
2015/2016,UEFA Champions League,Group Stage,9/15/15,H,Real Madrid,Shakhtar Donetsk,4:00,LW,64,3:00,Penalty,No assist,International,UEFA,Stage,2015-09-15,2015,4:00,4,0,4,0,Normal,LW,64
2015/2016,UEFA Champions League,Group Stage,9/15/15,H,Real Madrid,Shakhtar Donetsk,4:00,LW,82,4:00,Header,No assist,International,UEFA,Stage,2015-09-15,2015,4:00,4,0,4,0,Normal,LW,82
2015/2016,UEFA Champions League,Group Stage,9/30/15,A,Real Madrid,Malmö FF,0:02,LW ,29,0:01,Right-footed shot,Isco,International,UEFA,Stage,2015-09-30,2015,0:02,0,2,2,0,Normal,LW,29
2015/2016,UEFA Champions League,Group Stage,9/30/15,A,Real Madrid,Malmö FF,0:02,LW ,90,0:02,Left-footed shot,Lucas Vazquez,International,UEFA,Stage,2015-09-30,2015,0:02,0,2,2,0,Normal,LW,90
2015/2016,LaLiga,8,10/17/15,H,Real Madrid,Levante UD,3:00,CF,30,2:00,Right-footed shot,Toni Kroos,National Leagues,Spanish Football Federation (RFEF),Matchday,2015-10-17,2015,3:00,3,0,3,0,Normal,CF,30
2015/2016,LaLiga,9,10/24/15,A,Real Madrid,Celta de Vigo,1:03,CF,8,0:01,Right-footed shot,Lucas Vazquez,National Leagues,Spanish Football Federation (RFEF),Matchday,2015-10-24,2015,1:03,1,3,3,1,Normal,CF,8
2015/2016,LaLiga,10,10/31/15,H,Real Madrid,UD Las Palmas,3:01,CF,14,2:00,Header,Marcelo,National Leagues,Spanish Football Federation (RFEF),Matchday,2015-10-31,2015,3:01,3,1,3,1,Normal,CF,14
2015/2016,UEFA Champions League,Group Stage,11/25/15,A,Real Madrid,Shakhtar Donetsk,3:04,CF,18,0:01,Header,Gareth Bale,International,UEFA,Stage,2015-11-25,2015,3:04,3,4,4,3,Normal,CF,18
2015/2016,UEFA Champions League,Group Stage,11/25/15,A,Real Madrid,Shakhtar Donetsk,3:04,CF,70,0:04,Right-footed shot,Gareth Bale,International,UEFA,Stage,2015-11-25,2015,3:04,3,4,4,3,Normal,CF,70
2015/2016,LaLiga,13,11/29/15,A,Real Madrid,SD Eibar,0:02,CF,82,0:02,Penalty,No assist,National Leagues,Spanish Football Federation (RFEF),Matchday,2015-11-29,2015,0:02,0,2,2,0,Normal,CF,82
2015/2016,LaLiga,14,12-05-15,H,Real Madrid,Getafe CF,4:01,LW,38,4:00,Right-footed shot,Toni Kroos,National Leagues,Spanish Football Federation (RFEF),Matchday,2015-12-05,2015,4:01,4,1,4,1,Normal,LW,38
2015/2016,UEFA Champions League,Group Stage,12-08-15,H,Real Madrid,Malmö FF,8:00,LW,39,3:00,Direct free kick,No assist,International,UEFA,Stage,2015-12-08,2015,8:00,8,0,8,0,Normal,LW,39
2015/2016,UEFA Champions League,Group Stage,12-08-15,H,Real Madrid,Malmö FF,8:00,LW,47,4:00,Tap-in,No assist,International,UEFA,Stage,2015-12-08,2015,8:00,8,0,8,0,Normal,LW,47
2015/2016,UEFA Champions League,Group Stage,12-08-15,H,Real Madrid,Malmö FF,8:00,LW,50,5:00,Right-footed shot,Danilo,International,UEFA,Stage,2015-12-08,2015,8:00,8,0,8,0,Normal,LW,50
2015/2016,UEFA Champions League,Group Stage,12-08-15,H,Real Madrid,Malmö FF,8:00,LW,59,6:00,Right-footed shot,Isco,International,UEFA,Stage,2015-12-08,2015,8:00,8,0,8,0,Normal,LW,59
2015/2016,LaLiga,16,12/20/15,H,Real Madrid,Rayo Vallecano,10:02,LW,30,3:02,Penalty,No assist,National Leagues,Spanish Football Federation (RFEF),Matchday,2015-12-20,2015,10:02,10,2,10,2,Normal,LW,30
2015/2016,LaLiga,16,12/20/15,H,Real Madrid,Rayo Vallecano,10:02,LW,54,6:02,Header,James Rodriguez,National Leagues,Spanish Football Federation (RFEF),Matchday,2015-12-20,2015,10:02,10,2,10,2,Normal,LW,54
2015/2016,LaLiga,17,12/30/15,H,Real Madrid,Real Sociedad,3:01,LW,42,1:00,Penalty,No assist,National Leagues,Spanish Football Federation (RFEF),Matchday,2015-12-30,2015,3:01,3,1,3,1,Normal,LW,42
2015/2016,LaLiga,17,12/30/15,H,Real Madrid,Real Sociedad,3:01,LW,68,2:01,Left-footed shot,Marcelo,National Leagues,Spanish Football Federation (RFEF),Matchday,2015-12-30,2015,3:01,3,1,3,1,Normal,LW,68
2015/2016,LaLiga,20,1/17/16,H,Real Madrid,Sporting Gijón,5:01,LW,9,2:00,Left-footed shot,Karim Benzema,National Leagues,Spanish Football Federation (RFEF),Matchday,2016-01-17,2016,5:01,5,1,5,1,Normal,LW,9
2015/2016,LaLiga,20,1/17/16,H,Real Madrid,Sporting Gijón,5:01,LW,18,4:00,Left-footed shot,Daniel Carvajal,National Leagues,Spanish Football Federation (RFEF),Matchday,2016-01-17,2016,5:01,5,1,5,1,Normal,LW,18
2015/2016,LaLiga,22,1/31/16,H,Real Madrid,RCD Espanyol Barcelona,6:00,LW,12,2:00,Penalty,No assist,National Leagues,Spanish Football Federation (RFEF),Matchday,2016-01-31,2016,6:00,6,0,6,0,Normal,LW,12
2015/2016,LaLiga,22,1/31/16,H,Real Madrid,RCD Espanyol Barcelona,6:00,LW,45,4:00,Left-footed shot,No assist,National Leagues,Spanish Football Federation (RFEF),Matchday,2016-01-31,2016,6:00,6,0,6,0,Normal,LW,45
2015/2016,LaLiga,22,1/31/16,H,Real Madrid,RCD Espanyol Barcelona,6:00,LW,82,5:00,Header,Jese,National Leagues,Spanish Football Federation (RFEF),Matchday,2016-01-31,2016,6:00,6,0,6,0,Normal,LW,82
2015/2016,LaLiga,24,2/13/16,H,Real Madrid,Athletic Bilbao,4:02,LW,3,1:00,Right-footed shot,Karim Benzema,National Leagues,Spanish Football Federation (RFEF),Matchday,2016-02-13,2016,4:02,4,2,4,2,Normal,LW,3
2015/2016,LaLiga,24,2/13/16,H,Real Madrid,Athletic Bilbao,4:02,LW,87,4:01,Right-footed shot,Lucas Vazquez,National Leagues,Spanish Football Federation (RFEF),Matchday,2016-02-13,2016,4:02,4,2,4,2,Normal,LW,87
2015/2016,UEFA Champions League,Last 16,2/17/16,A,Real Madrid,AS Roma,0:02,LW,57,0:01,Right-footed shot,Marcelo,International,UEFA,Stage,2016-02-17,2016,0:02,0,2,2,0,Normal,LW,57
2015/2016,LaLiga,25,2/21/16,A,Real Madrid,Malaga CF,1:01,LW,33,0:01,Header,Toni Kroos,National Leagues,Spanish Football Federation (RFEF),Matchday,2016-02-21,2016,1:01,1,1,1,1,Normal,LW,33
2015/2016,LaLiga,27,03-02-16,A,Real Madrid,Levante UD,1:03,LW,34,0:01,Penalty,No assist,National Leagues,Spanish Football Federation (RFEF),Matchday,2016-03-02,2016,1:03,1,3,3,1,Normal,LW,34
2015/2016,LaLiga,28,03-05-16,H,Real Madrid,Celta de Vigo,7:01,LW,50,2:00,Long distance kick,Sergio Ramos,National Leagues,Spanish Football Federation (RFEF),Matchday,2016-03-05,2016,7:01,7,1,7,1,Normal,LW,50
2015/2016,LaLiga,28,03-05-16,H,Real Madrid,Celta de Vigo,7:01,LW,58,3:00,Direct free kick,No assist,National Leagues,Spanish Football Federation (RFEF),Matchday,2016-03-05,2016,7:01,7,1,7,1,Normal,LW,58
2015/2016,LaLiga,28,03-05-16,H,Real Madrid,Celta de Vigo,7:01,LW,64,4:01,Right-footed shot,Isco,National Leagues,Spanish Football Federation (RFEF),Matchday,2016-03-05,2016,7:01,7,1,7,1,Normal,LW,64
2015/2016,LaLiga,28,03-05-16,H,Real Madrid,Celta de Vigo,7:01,LW,76,5:01,Header,Jese,National Leagues,Spanish Football Federation (RFEF),Matchday,2016-03-05,2016,7:01,7,1,7,1,Normal,LW,76
2015/2016,UEFA Champions League,Last 16,03-08-16,H,Real Madrid,AS Roma,2:00,CF,64,1:00,Right-footed shot,Lucas Vazquez,International,UEFA,Stage,2016-03-08,2016,2:00,2,0,2,0,Normal,CF,64
2015/2016,LaLiga,30,3/20/16,H,Real Madrid,Sevilla FC,4:00,LW,64,2:00,Left-footed shot,Danilo,National Leagues,Spanish Football Federation (RFEF),Matchday,2016-03-20,2016,4:00,4,0,4,0,Normal,LW,64
2015/2016,LaLiga,31,04-02-16,A,Real Madrid,FC Barcelona,1:02,LW,85,1:02,Right-footed shot,Gareth Bale,National Leagues,Spanish Football Federation (RFEF),Matchday,2016-04-02,2016,1:02,1,2,2,1,Normal,LW,85
2015/2016,LaLiga,32,04-09-16,H,Real Madrid,SD Eibar,4:00,CF,19,3:00,Right-footed shot,Jese,National Leagues,Spanish Football Federation (RFEF),Matchday,2016-04-09,2016,4:00,4,0,4,0,Normal,CF,19
2015/2016,UEFA Champions League,Quarter-Finals,04-12-16,H,Real Madrid,VfL Wolfsburg,3:00,LW,16,1:00,Right-footed shot,Daniel Carvajal,International,UEFA,Stage,2016-04-12,2016,3:00,3,0,3,0,Normal,LW,16
2015/2016,UEFA Champions League,Quarter-Finals,04-12-16,H,Real Madrid,VfL Wolfsburg,3:00,LW,17,2:00,Header,Toni Kroos,International,UEFA,Stage,2016-04-12,2016,3:00,3,0,3,0,Normal,LW,17
2015/2016,UEFA Champions League,Quarter-Finals,04-12-16,H,Real Madrid,VfL Wolfsburg,3:00,LW,77,3:00,Direct free kick,No assist,International,UEFA,Stage,2016-04-12,2016,3:00,3,0,3,0,Normal,LW,77
2015/2016,LaLiga,33,4/16/16,A,Real Madrid,Getafe CF,1:05,LW,90+2,1:05,Left-footed shot,Jese,National Leagues,Spanish Football Federation (RFEF),Matchday,2016-04-16,2016,1:05,1,5,5,1,Normal,LW,92
2015/2016,LaLiga,37,05-08-16,H,Real Madrid,Valencia CF,3:02,LW,26,1:00,Right-footed shot,Marcelo,National Leagues,Spanish Football Federation (RFEF),Matchday,2016-05-08,2016,3:02,3,2,3,2,Normal,LW,26
2015/2016,LaLiga,37,05-08-16,H,Real Madrid,Valencia CF,3:02,LW,59,3:01,Left-footed shot,James Rodriguez,National Leagues,Spanish Football Federation (RFEF),Matchday,2016-05-08,2016,3:02,3,2,3,2,Normal,LW,59
2015/2016,LaLiga,38,5/14/16,A,Real Madrid,Deportivo de La Coruña,0:02,LW,8,0:01,Left-footed shot,Karim Benzema,National Leagues,Spanish Football Federation (RFEF),Matchday,2016-05-14,2016,0:02,0,2,2,0,Normal,LW,8
2015/2016,LaLiga,38,5/14/16,A,Real Madrid,Deportivo de La Coruña,0:02,LW,25,0:02,Header,Toni Kroos,National Leagues,Spanish Football Federation (RFEF),Matchday,2016-05-14,2016,0:02,0,2,2,0,Normal,LW,25
2016/2017,LaLiga,3,09-10-16,H,Real Madrid,CA Osasuna,5:02,LW,6,1:00,Right-footed shot,Gareth Bale,National Leagues,Spanish Football Federation (RFEF),Matchday,2016-09-10,2016,5:02,5,2,5,2,Normal,LW,6
2016/2017,UEFA Champions League,Group Stage,9/14/16,H,Real Madrid,Sporting CP,2:01,LW,89,1:01,Direct free kick,No assist,International,UEFA,Stage,2016-09-14,2016,2:01,2,1,2,1,Normal,LW,89
2016/2017,UEFA Champions League,Group Stage,9/27/16,A,Real Madrid,Borussia Dortmund,2:02,LW,17,0:01,Right-footed shot,Gareth Bale,International,UEFA,Stage,2016-09-27,2016,2:02,2,2,2,2,Normal,LW,17
2016/2017,LaLiga,8,10/15/16,A,Real Madrid,Real Betis Balompie,1:06,LW,78,1:06,Right-footed shot,alvaro Morata,National Leagues,Spanish Football Federation (RFEF),Matchday,2016-10-15,2016,1:06,1,6,6,1,Normal,LW,78
2016/2017,LaLiga,10,10/29/16,A,Real Madrid,Deportivo Alaves,1:04,LW,17,1:01,Penalty,No assist,National Leagues,Spanish Football Federation (RFEF),Matchday,2016-10-29,2016,1:04,1,4,4,1,Normal,LW,17
2016/2017,LaLiga,10,10/29/16,A,Real Madrid,Deportivo Alaves,1:04,LW,33,1:02,Right-footed shot,Karim Benzema,National Leagues,Spanish Football Federation (RFEF),Matchday,2016-10-29,2016,1:04,1,4,4,1,Normal,LW,33
2016/2017,LaLiga,10,10/29/16,A,Real Madrid,Deportivo Alaves,1:04,LW,88,1:04,Right-footed shot,Marcelo,National Leagues,Spanish Football Federation (RFEF),Matchday,2016-10-29,2016,1:04,1,4,4,1,Normal,LW,88
2016/2017,LaLiga,12,11/19/16,A,Real Madrid,Atletico de Madrid,0:03,CF,23,0:01,Direct free kick,No assist,National Leagues,Spanish Football Federation (RFEF),Matchday,2016-11-19,2016,0:03,0,3,3,0,Normal,CF,23
2016/2017,LaLiga,12,11/19/16,A,Real Madrid,Atletico de Madrid,0:03,CF,71,0:02,Penalty,No assist,National Leagues,Spanish Football Federation (RFEF),Matchday,2016-11-19,2016,0:03,0,3,3,0,Normal,CF,71
2016/2017,LaLiga,12,11/19/16,A,Real Madrid,Atletico de Madrid,0:03,CF,77,0:03,Right-footed shot,Gareth Bale,National Leagues,Spanish Football Federation (RFEF),Matchday,2016-11-19,2016,0:03,0,3,3,0,Normal,CF,77
2016/2017,LaLiga,13,11/26/16,H,Real Madrid,Sporting Gijón,2:01,LW,5,1:00,Penalty,No assist,National Leagues,Spanish Football Federation (RFEF),Matchday,2016-11-26,2016,2:01,2,1,2,1,Normal,LW,5
2016/2017,LaLiga,13,11/26/16,H,Real Madrid,Sporting Gijón,2:01,LW,18,2:00,Header,Nacho Fernandez,National Leagues,Spanish Football Federation (RFEF),Matchday,2016-11-26,2016,2:01,2,1,2,1,Normal,LW,18
2016/2017,FIFA Club World Cup,Semi-Finals,12/15/16,A,Real Madrid,CF America,0:02,LW,90+3,0:02,Right-footed shot,James Rodriguez,International,FIFA,Stage,2016-12-15,2016,0:02,0,2,2,0,Normal,LW,93
2016/2017,FIFA Club World Cup,Final,12/18/16,H,Real Madrid,Kashima Antlers,4:2 AET,LW,60,2:02,Penalty,No assist,International,FIFA,Stage,2016-12-18,2016,4:2,4,2,4,2,After Extra Time,LW,60
2016/2017,FIFA Club World Cup,Final,12/18/16,H,Real Madrid,Kashima Antlers,4:2 AET,LW,97,3:02,Left-footed shot,Karim Benzema,International,FIFA,Stage,2016-12-18,2016,4:2,4,2,4,2,After Extra Time,LW,97
2016/2017,FIFA Club World Cup,Final,12/18/16,H,Real Madrid,Kashima Antlers,4:2 AET,LW,104,4:02,Left-footed shot,Toni Kroos,International,FIFA,Stage,2016-12-18,2016,4:2,4,2,4,2,After Extra Time,LW,104
2016/2017,LaLiga,17,01-07-17,H,Real Madrid,Granada CF,5:00,LW,27,3:00,Header,Marcelo,National Leagues,Spanish Football Federation (RFEF),Matchday,2017-01-07,2017,5:00,5,0,5,0,Normal,LW,27
2016/2017,LaLiga,18,1/15/17,A,Real Madrid,Sevilla FC,2:01,CF,67,0:01,Penalty,No assist,National Leagues,Spanish Football Federation (RFEF),Matchday,2017-01-15,2017,2:01,2,1,1,2,Normal,CF,67
2016/2017,Copa del Rey,Quarter-Finals,1/25/17,A,Real Madrid,Celta de Vigo,2:02,CF,62,1:01,Direct free kick,No assist,National Cups,Spanish Football Federation (RFEF),Stage,2017-01-25,2017,2:02,2,2,2,2,Normal,CF,62
2016/2017,LaLiga,20,1/29/17,H,Real Madrid,Real Sociedad,3:00,LW,51,2:00,Right-footed shot,Mateo Kovacic,National Leagues,Spanish Football Federation (RFEF),Matchday,2017-01-29,2017,3:00,3,0,3,0,Normal,LW,51
2016/2017,LaLiga,22,02-11-17,A,Real Madrid,CA Osasuna,1:03,CF,24,0:01,Right-footed shot,Karim Benzema,National Leagues,Spanish Football Federation (RFEF),Matchday,2017-02-11,2017,1:03,1,3,3,1,Normal,CF,24
2016/2017,LaLiga,16,2/22/17,A,Real Madrid,Valencia CF,2:01,LW,44,2:01,Header,Marcelo,National Leagues,Spanish Football Federation (RFEF),Matchday,2017-02-22,2017,2:01,2,1,1,2,Normal,LW,44
2016/2017,LaLiga,24,2/26/17,A,Real Madrid,Villarreal CF,2:03,LW,74,2:02,Penalty,No assist,National Leagues,Spanish Football Federation (RFEF),Matchday,2017-02-26,2017,2:03,2,3,3,2,Normal,LW,74
2016/2017,LaLiga,25,03-01-17,H,Real Madrid,UD Las Palmas,3:03,LW,86,2:03,Penalty,No assist,National Leagues,Spanish Football Federation (RFEF),Matchday,2017-03-01,2017,3:03,3,3,3,3,Normal,LW,86
2016/2017,LaLiga,25,03-01-17,H,Real Madrid,UD Las Palmas,3:03,LW,89,3:03,Header,James Rodriguez,National Leagues,Spanish Football Federation (RFEF),Matchday,2017-03-01,2017,3:03,3,3,3,3,Normal,LW,89
2016/2017,LaLiga,27,03-12-17,H,Real Madrid,Real Betis Balompie,2:01,LW,41,1:01,Header,Marcelo,National Leagues,Spanish Football Federation (RFEF),Matchday,2017-03-12,2017,2:01,2,1,2,1,Normal,LW,41
2016/2017,UEFA Champions League,Quarter-Finals,04-12-17,A,Real Madrid,Bayern Munich,1:02,LW,47,1:01,Right-footed shot,Daniel Carvajal,International,UEFA,Stage,2017-04-12,2017,1:02,1,2,2,1,Normal,LW,47
2016/2017,UEFA Champions League,Quarter-Finals,04-12-17,A,Real Madrid,Bayern Munich,1:02,LW,77,1:02,Right-footed shot,Marco Asensio,International,UEFA,Stage,2017-04-12,2017,1:02,1,2,2,1,Normal,LW,77
2016/2017,UEFA Champions League,Quarter-Finals,4/18/17,H,Real Madrid,Bayern Munich,4:2 AET,CF,76,1:01,Header,Casemiro,International,UEFA,Stage,2017-04-18,2017,4:2,4,2,4,2,After Extra Time,CF,76
2016/2017,UEFA Champions League,Quarter-Finals,4/18/17,H,Real Madrid,Bayern Munich,4:2 AET,CF,105,2:02,Left-footed shot,Sergio Ramos,International,UEFA,Stage,2017-04-18,2017,4:2,4,2,4,2,After Extra Time,CF,105
2016/2017,UEFA Champions League,Quarter-Finals,4/18/17,H,Real Madrid,Bayern Munich,4:2 AET,CF,109,3:02,Right-footed shot,Marcelo,International,UEFA,Stage,2017-04-18,2017,4:2,4,2,4,2,After Extra Time,CF,109
2016/2017,LaLiga,35,4/29/17,H,Real Madrid,Valencia CF,2:01,LW,27,1:00,Header,Daniel Carvajal,National Leagues,Spanish Football Federation (RFEF),Matchday,2017-04-29,2017,2:01,2,1,2,1,Normal,LW,27
2016/2017,UEFA Champions League,Semi-Finals,05-02-17,H,Real Madrid,Atletico de Madrid,3:00,CF,10,1:00,Header,Casemiro,International,UEFA,Stage,2017-05-02,2017,3:00,3,0,3,0,Normal,CF,10
2016/2017,UEFA Champions League,Semi-Finals,05-02-17,H,Real Madrid,Atletico de Madrid,3:00,CF,73,2:00,Right-footed shot,Karim Benzema,International,UEFA,Stage,2017-05-02,2017,3:00,3,0,3,0,Normal,CF,73
2016/2017,UEFA Champions League,Semi-Finals,05-02-17,H,Real Madrid,Atletico de Madrid,3:00,CF,86,3:00,Right-footed shot,Lucas Vazquez,International,UEFA,Stage,2017-05-02,2017,3:00,3,0,3,0,Normal,CF,86
2016/2017,LaLiga,37,5/14/17,H,Real Madrid,Sevilla FC,4:01,LW,23,2:00,Right-footed shot,No assist,National Leagues,Spanish Football Federation (RFEF),Matchday,2017-05-14,2017,4:01,4,1,4,1,Normal,LW,23
2016/2017,LaLiga,37,5/14/17,H,Real Madrid,Sevilla FC,4:01,LW,78,3:01,Left-footed shot,Toni Kroos,National Leagues,Spanish Football Federation (RFEF),Matchday,2017-05-14,2017,4:01,4,1,4,1,Normal,LW,78
2016/2017,LaLiga,21,5/17/17,A,Real Madrid,Celta de Vigo,1:04,CF,10,0:01,Left-footed shot,No assist,National Leagues,Spanish Football Federation (RFEF),Matchday,2017-05-17,2017,1:04,1,4,4,1,Normal,CF,10
2016/2017,LaLiga,21,5/17/17,A,Real Madrid,Celta de Vigo,1:04,CF,48,0:02,Left-footed shot,Isco,National Leagues,Spanish Football Federation (RFEF),Matchday,2017-05-17,2017,1:04,1,4,4,1,Normal,CF,48
2016/2017,LaLiga,38,5/21/17,A,Real Madrid,Malaga CF,0:02,CF,2,0:01,Right-footed shot,Isco,National Leagues,Spanish Football Federation (RFEF),Matchday,2017-05-21,2017,0:02,0,2,2,0,Normal,CF,2
2016/2017,UEFA Champions League,Final,06-03-17,A,Real Madrid,Juventus FC,1:04,CF,20,0:01,Right-footed shot,Daniel Carvajal,International,UEFA,Stage,2017-06-03,2017,1:04,1,4,4,1,Normal,CF,20
2016/2017,UEFA Champions League,Final,06-03-17,A,Real Madrid,Juventus FC,1:04,CF,64,1:03,Right-footed shot,Luka Modric,International,UEFA,Stage,2017-06-03,2017,1:04,1,4,4,1,Normal,CF,64
2017/2018,Supercopa,Final,8/13/17,A,Real Madrid,FC Barcelona,1:03,CF,80,1:02,Right-footed shot,Isco,National SuperCups,Spanish Football Federation (RFEF),Stage,2017-08-13,2017,1:03,1,3,3,1,Normal,CF,80
2017/2018,UEFA Champions League,Group Stage,9/13/17,H,Real Madrid,APOEL Nicosia,3:00,CF,12,1:00,Counter attack goal,Gareth Bale,International,UEFA,Stage,2017-09-13,2017,3:00,3,0,3,0,Normal,CF,12
2017/2018,UEFA Champions League,Group Stage,9/13/17,H,Real Madrid,APOEL Nicosia,3:00,CF,51,2:00,Penalty,No assist,International,UEFA,Stage,2017-09-13,2017,3:00,3,0,3,0,Normal,CF,51
2017/2018,UEFA Champions League,Group Stage,9/26/17,A,Real Madrid,Borussia Dortmund,1:03,CF,49,0:02,Left-footed shot,Gareth Bale,International,UEFA,Stage,2017-09-26,2017,1:03,1,3,3,1,Normal,CF,49
2017/2018,UEFA Champions League,Group Stage,9/26/17,A,Real Madrid,Borussia Dortmund,1:03,CF,79,1:03,Right-footed shot,Luka Modric,International,UEFA,Stage,2017-09-26,2017,1:03,1,3,3,1,Normal,CF,79
2017/2018,LaLiga,8,10/14/17,A,Real Madrid,Getafe CF,1:02,CF,85,1:02,Right-footed shot,Isco,National Leagues,Spanish Football Federation (RFEF),Matchday,2017-10-14,2017,1:02,1,2,2,1,Normal,CF,85
2017/2018,UEFA Champions League,Group Stage,10/17/17,H,Real Madrid,Tottenham Hotspur,1:01,LW,43,1:01,Penalty,No assist,International,UEFA,Stage,2017-10-17,2017,1:01,1,1,1,1,Normal,LW,43
2017/2018,UEFA Champions League,Group Stage,11-01-17,A,Real Madrid,Tottenham Hotspur,3:01,LW,80,3:01,Right-footed shot,Borja Mayoral,International,UEFA,Stage,2017-11-01,2017,3:01,3,1,1,3,Normal,LW,80
2017/2018,UEFA Champions League,Group Stage,11/21/17,A,Real Madrid,APOEL Nicosia,0:06,LW,49,0:05,Header,Marcelo,International,UEFA,Stage,2017-11-21,2017,0:06,0,6,6,0,Normal,LW,49
2017/2018,UEFA Champions League,Group Stage,11/21/17,A,Real Madrid,APOEL Nicosia,0:06,LW,54,0:06,Left-footed shot,No assist,International,UEFA,Stage,2017-11-21,2017,0:06,0,6,6,0,Normal,LW,54
2017/2018,LaLiga,13,11/25/17,H,Real Madrid,Malaga CF,3:02,CF,76,3:02,Penalty rebound,No assist,National Leagues,Spanish Football Federation (RFEF),Matchday,2017-11-25,2017,3:02,3,2,3,2,Normal,CF,76
2017/2018,UEFA Champions League,Group Stage,12-06-17,H,Real Madrid,Borussia Dortmund,3:02,LW,12,2:00,Right-footed shot,Mateo Kovacic,International,UEFA,Stage,2017-12-06,2017,3:02,3,2,3,2,Normal,LW,12
2017/2018,LaLiga,15,12-09-17,H,Real Madrid,Sevilla FC,5:00,CF,23,2:00,Right-footed shot,Marco Asensio,National Leagues,Spanish Football Federation (RFEF),Matchday,2017-12-09,2017,5:00,5,0,5,0,Normal,CF,23
2017/2018,LaLiga,15,12-09-17,H,Real Madrid,Sevilla FC,5:00,CF,31,3:00,Penalty,No assist,National Leagues,Spanish Football Federation (RFEF),Matchday,2017-12-09,2017,5:00,5,0,5,0,Normal,CF,31
2017/2018,FIFA Club World Cup,Semi-Finals,12/13/17,A,Real Madrid,Al-Jazira (Abu Dhabi),1:02,LW,53,1:01,Right-footed shot,Luka Modric,International,FIFA,Stage,2017-12-13,2017,1:02,1,2,2,1,Normal,LW,53
2017/2018,FIFA Club World Cup,Final,12/16/17,H,Real Madrid,Grêmio Foot-Ball Porto Alegrense,1:00,LW,53,1:00,Direct free kick,No assist,International,FIFA,Stage,2017-12-16,2017,1:00,1,0,1,0,Normal,LW,53
2017/2018,LaLiga,20,1/21/18,H,Real Madrid,Deportivo de La Coruña,7:01,LW,78,5:01,Left-footed shot,Casemiro,National Leagues,Spanish Football Federation (RFEF),Matchday,2018-01-21,2018,7:01,7,1,7,1,Normal,LW,78
2017/2018,LaLiga,20,1/21/18,H,Real Madrid,Deportivo de La Coruña,7:01,LW,84,6:01,Header,Lucas Vazquez,National Leagues,Spanish Football Federation (RFEF),Matchday,2018-01-21,2018,7:01,7,1,7,1,Normal,LW,84
2017/2018,LaLiga,21,1/27/18,A,Real Madrid,Valencia CF,1:04,LW,16,0:01,Penalty,No assist,National Leagues,Spanish Football Federation (RFEF),Matchday,2018-01-27,2018,1:04,1,4,4,1,Normal,LW,16
2017/2018,LaLiga,21,1/27/18,A,Real Madrid,Valencia CF,1:04,LW,38,0:02,Penalty,No assist,National Leagues,Spanish Football Federation (RFEF),Matchday,2018-01-27,2018,1:04,1,4,4,1,Normal,LW,38
2017/2018,LaLiga,23,02-10-18,H,Real Madrid,Real Sociedad,5:02,CF,27,2:00,Right-footed shot,Marcelo,National Leagues,Spanish Football Federation (RFEF),Matchday,2018-02-10,2018,5:02,5,2,5,2,Normal,CF,27
2017/2018,LaLiga,23,02-10-18,H,Real Madrid,Real Sociedad,5:02,CF,37,4:00,Header,Luka Modric,National Leagues,Spanish Football Federation (RFEF),Matchday,2018-02-10,2018,5:02,5,2,5,2,Normal,CF,37
2017/2018,LaLiga,23,02-10-18,H,Real Madrid,Real Sociedad,5:02,CF,80,5:01,Tap-in,No assist,National Leagues,Spanish Football Federation (RFEF),Matchday,2018-02-10,2018,5:02,5,2,5,2,Normal,CF,80
2017/2018,UEFA Champions League,Last 16,2/14/18,H,Real Madrid,Paris Saint-Germain,3:01,LW,45,1:01,Penalty,No assist,International,UEFA,Stage,2018-02-14,2018,3:01,3,1,3,1,Normal,LW,45
2017/2018,UEFA Champions League,Last 16,2/14/18,H,Real Madrid,Paris Saint-Germain,3:01,LW,83,2:01,Tap-in,No assist,International,UEFA,Stage,2018-02-14,2018,3:01,3,1,3,1,Normal,LW,83
2017/2018,LaLiga,24,2/18/18,A,Real Madrid,Real Betis Balompie,3:05,CF,65,2:04,Right-footed shot,Casemiro,National Leagues,Spanish Football Federation (RFEF),Matchday,2018-02-18,2018,3:05,3,5,5,3,Normal,CF,65
2017/2018,LaLiga,25,2/24/18,H,Real Madrid,Deportivo Alaves,4:00,CF ,44,1:00,Left-footed shot,Karim Benzema,National Leagues,Spanish Football Federation (RFEF),Matchday,2018-02-24,2018,4:00,4,0,4,0,Normal,CF,44
2017/2018,LaLiga,25,2/24/18,H,Real Madrid,Deportivo Alaves,4:00,CF ,61,3:00,Right-footed shot,Lucas Vazquez,National Leagues,Spanish Football Federation (RFEF),Matchday,2018-02-24,2018,4:00,4,0,4,0,Normal,CF,61
2017/2018,LaLiga,27,03-03-18,H,Real Madrid,Getafe CF,3:01,CF,45+1,2:00,Left-footed shot,Karim Benzema,National Leagues,Spanish Football Federation (RFEF),Matchday,2018-03-03,2018,3:01,3,1,3,1,Normal,CF,46
2017/2018,LaLiga,27,03-03-18,H,Real Madrid,Getafe CF,3:01,CF,78,3:01,Header,Marcelo,National Leagues,Spanish Football Federation (RFEF),Matchday,2018-03-03,2018,3:01,3,1,3,1,Normal,CF,78
2017/2018,UEFA Champions League,Last 16,03-06-18,A,Real Madrid,Paris Saint-Germain,1:02,CF,51,0:01,Header,Lucas Vazquez,International,UEFA,Stage,2018-03-06,2018,1:02,1,2,2,1,Normal,CF,51
2017/2018,LaLiga,28,03-10-18,A,Real Madrid,SD Eibar,1:02,CF,33,0:01,Right-footed shot,Luka Modric,National Leagues,Spanish Football Federation (RFEF),Matchday,2018-03-10,2018,1:02,1,2,2,1,Normal,CF,33
2017/2018,LaLiga,28,03-10-18,A,Real Madrid,SD Eibar,1:02,CF,84,1:02,Header,Daniel Carvajal,National Leagues,Spanish Football Federation (RFEF),Matchday,2018-03-10,2018,1:02,1,2,2,1,Normal,CF,84
2017/2018,LaLiga,29,3/18/18,H,Real Madrid,Girona FC,6:03,CF,11,1:00,Left-footed shot,Toni Kroos,National Leagues,Spanish Football Federation (RFEF),Matchday,2018-03-18,2018,6:03,6,3,6,3,Normal,CF,11
2017/2018,LaLiga,29,3/18/18,H,Real Madrid,Girona FC,6:03,CF,47,2:01,Left-footed shot,Karim Benzema,National Leagues,Spanish Football Federation (RFEF),Matchday,2018-03-18,2018,6:03,6,3,6,3,Normal,CF,47
2017/2018,LaLiga,29,3/18/18,H,Real Madrid,Girona FC,6:03,CF,64,4:01,Tap-in,No assist,National Leagues,Spanish Football Federation (RFEF),Matchday,2018-03-18,2018,6:03,6,3,6,3,Normal,CF,64
2017/2018,LaLiga,29,3/18/18,H,Real Madrid,Girona FC,6:03,CF,90+1,6:03,Right-footed shot,Toni Kroos,National Leagues,Spanish Football Federation (RFEF),Matchday,2018-03-18,2018,6:03,6,3,6,3,Normal,CF,91
2017/2018,UEFA Champions League,Quarter-Finals,04-03-18,A,Real Madrid,Juventus FC,0:03,CF,3,0:01,Right-footed shot,Isco,International,UEFA,Stage,2018-04-03,2018,0:03,0,3,3,0,Normal,CF,3
2017/2018,UEFA Champions League,Quarter-Finals,04-03-18,A,Real Madrid,Juventus FC,0:03,CF,64,0:02,Right-footed shot,Daniel Carvajal,International,UEFA,Stage,2018-04-03,2018,0:03,0,3,3,0,Normal,CF,64
2017/2018,LaLiga,31,04-08-18,H,Real Madrid,Atletico de Madrid,1:01,CF,53,1:00,Right-footed shot,Gareth Bale,National Leagues,Spanish Football Federation (RFEF),Matchday,2018-04-08,2018,1:01,1,1,1,1,Normal,CF,53
2017/2018,UEFA Champions League,Quarter-Finals,04-11-18,H,Real Madrid,Juventus FC,1:03,CF,90+7,1:03,Penalty,No assist,International,UEFA,Stage,2018-04-11,2018,1:03,1,3,1,3,Normal,CF,97
2017/2018,LaLiga,33,4/18/18,H,Real Madrid,Athletic Bilbao,1:01,CF,87,1:01,Right-footed shot,Luka Modric,National Leagues,Spanish Football Federation (RFEF),Matchday,2018-04-18,2018,1:01,1,1,1,1,Normal,CF,87
2017/2018,LaLiga,36,05-06-18,A,Real Madrid,FC Barcelona,2:02,LW,14,1:01,Right-footed shot,Karim Benzema,National Leagues,Spanish Football Federation (RFEF),Matchday,2018-05-06,2018,2:02,2,2,2,2,Normal,LW,14
2017/2018,LaLiga,38,5/19/18,A,Real Madrid,Villarreal CF,2:02,CF,32,0:02,Header,Marcelo,National Leagues,Spanish Football Federation (RFEF),Matchday,2018-05-19,2018,2:02,2,2,2,2,Normal,CF,32
2018/2019,Serie A,4,9/16/18,H,Juventus FC,US Sassuolo,2:01,CF,50,1:00,Tap-in,No assist,National Leagues,Italian Football Federation (FIGC),Matchday,2018-09-16,2018,2:01,2,1,2,1,Normal,CF,50
2018/2019,Serie A,4,9/16/18,H,Juventus FC,US Sassuolo,2:01,CF,65,2:00,Left-footed shot,Emre Can,National Leagues,Italian Football Federation (FIGC),Matchday,2018-09-16,2018,2:01,2,1,2,1,Normal,CF,65
2018/2019,Serie A,5,9/23/18,A,Juventus FC,Frosinone Calcio,0:02,LW,81,0:01,Left-footed shot,No assist,National Leagues,Italian Football Federation (FIGC),Matchday,2018-09-23,2018,0:02,0,2,2,0,Normal,LW,81
2018/2019,Serie A,8,10-06-18,A,Juventus FC,Udinese Calcio,0:02,LW,37,0:02,Left-footed shot,Mario Mandzukic,National Leagues,Italian Football Federation (FIGC),Matchday,2018-10-06,2018,0:02,0,2,2,0,Normal,LW,37
2018/2019,Serie A,9,10/20/18,H,Juventus FC,Genoa CFC,1:01,LW,18,1:00,Tap-in,No assist,National Leagues,Italian Football Federation (FIGC),Matchday,2018-10-20,2018,1:01,1,1,1,1,Normal,LW,18
2018/2019,Serie A,10,10/27/18,A,Juventus FC,Empoli FC ,1:02,CF,54,1:01,Penalty,No assist,National Leagues,Italian Football Federation (FIGC),Matchday,2018-10-27,2018,1:02,1,2,2,1,Normal,CF,54
2018/2019,Serie A,10,10/27/18,A,Juventus FC,Empoli FC ,1:02,CF,70,1:02,Right-footed shot,Blaise Matuidi,National Leagues,Italian Football Federation (FIGC),Matchday,2018-10-27,2018,1:02,1,2,2,1,Normal,CF,70
2018/2019,UEFA Champions League,Group Stage,11-07-18,H,Juventus FC,Manchester United,1:02,CF,65,1:00,Right-footed shot,Leonardo Bonucci,International,UEFA,Stage,2018-11-07,2018,1:02,1,2,1,2,Normal,CF,65
2018/2019,Serie A,12,11-11-18,A,Juventus FC,AC Milan,0:02,LW,81,0:02,Tap-in,No assist,National Leagues,Italian Football Federation (FIGC),Matchday,2018-11-11,2018,0:02,0,2,2,0,Normal,LW,81
2018/2019,Serie A,13,11/24/18,H,Juventus FC,SPAL,2:00,CF,29,1:00,Left-footed shot,Miralem Pjanic,National Leagues,Italian Football Federation (FIGC),Matchday,2018-11-24,2018,2:00,2,0,2,0,Normal,CF,29
2018/2019,Serie A,14,12-01-18,A,Juventus FC,ACF Fiorentina,0:03,LW,79,0:03,Penalty,No assist,National Leagues,Italian Football Federation (FIGC),Matchday,2018-12-01,2018,0:03,0,3,3,0,Normal,LW,79
2018/2019,Serie A,16,12/15/18,A,Juventus FC,Torino FC,0:01,LW,70,0:01,Penalty,No assist,National Leagues,Italian Football Federation (FIGC),Matchday,2018-12-15,2018,0:01,0,1,1,0,Normal,LW,70
2018/2019,Serie A,18,12/26/18,A,Juventus FC,Atalanta BC,2:02,CF,78,2:02,Header,Giorgio Chiellini,National Leagues,Italian Football Federation (FIGC),Matchday,2018-12-26,2018,2:02,2,2,2,2,Normal,CF,78
2018/2019,Serie A,19,12/29/18,H,Juventus FC,UC Sampdoria,2:01,LW,2,1:00,Right-footed shot,Paulo Dybala,National Leagues,Italian Football Federation (FIGC),Matchday,2018-12-29,2018,2:01,2,1,2,1,Normal,LW,2
2018/2019,Serie A,19,12/29/18,H,Juventus FC,UC Sampdoria,2:01,LW,65,2:01,Penalty,No assist,National Leagues,Italian Football Federation (FIGC),Matchday,2018-12-29,2018,2:01,2,1,2,1,Normal,LW,65
2018/2019,Supercoppa Italiana,Final,1/16/19,H,Juventus FC,AC Milan,1:00,LW,61,1:00,Header,Miralem Pjanic,National SuperCups,Italian Football Federation (FIGC),Stage,2019-01-16,2019,1:00,1,0,1,0,Normal,LW,61
2018/2019,Serie A,21,1/27/19,A,Juventus FC,SS Lazio,1:02,LW,88,1:02,Penalty,No assist,National Leagues,Italian Football Federation (FIGC),Matchday,2019-01-27,2019,1:02,1,2,2,1,Normal,LW,88
2018/2019,Serie A,22,02-02-19,H,Juventus FC,Parma Calcio 1913,3:03,LW,36,1:00,Right-footed shot,Blaise Matuidi,National Leagues,Italian Football Federation (FIGC),Matchday,2019-02-02,2019,3:03,3,3,3,3,Normal,LW,36
2018/2019,Serie A,22,02-02-19,H,Juventus FC,Parma Calcio 1913,3:03,LW,66,3:01,Header,Mario Mandzukic,National Leagues,Italian Football Federation (FIGC),Matchday,2019-02-02,2019,3:03,3,3,3,3,Normal,LW,66
2018/2019,Serie A,23,02-10-19,A,Juventus FC,US Sassuolo,0:03,LW,70,0:02,Header,Miralem Pjanic,National Leagues,Italian Football Federation (FIGC),Matchday,2019-02-10,2019,0:03,0,3,3,0,Normal,LW,70
2018/2019,Serie A,24,2/15/19,H,Juventus FC,Frosinone Calcio,3:00,LW,63,3:00,Right-footed shot,Mario Mandzukic,National Leagues,Italian Football Federation (FIGC),Matchday,2019-02-15,2019,3:00,3,0,3,0,Normal,LW,63
2018/2019,UEFA Champions League,Last 16,03-12-19,H,Juventus FC,Atletico de Madrid,3:00,CF,27,1:00,Header,Federico Bernardeschi,International,UEFA,Stage,2019-03-12,2019,3:00,3,0,3,0,Normal,CF,27
2018/2019,UEFA Champions League,Last 16,03-12-19,H,Juventus FC,Atletico de Madrid,3:00,CF,49,2:00,Header,João Cancelo,International,UEFA,Stage,2019-03-12,2019,3:00,3,0,3,0,Normal,CF,49
2018/2019,UEFA Champions League,Last 16,03-12-19,H,Juventus FC,Atletico de Madrid,3:00,CF,86,3:00,Penalty,No assist,International,UEFA,Stage,2019-03-12,2019,3:00,3,0,3,0,Normal,CF,86
2018/2019,UEFA Champions League,Quarter-Finals,04-10-19,A,Juventus FC,Ajax Amsterdam,1:01,LW,45,0:01,Header,João Cancelo,International,UEFA,Stage,2019-04-10,2019,1:01,1,1,1,1,Normal,LW,45
2018/2019,UEFA Champions League,Quarter-Finals,4/16/19,H,Juventus FC,Ajax Amsterdam,1:02,LW,28,1:00,Header,Miralem Pjanic,International,UEFA,Stage,2019-04-16,2019,1:02,1,2,1,2,Normal,LW,28
2018/2019,Serie A,34,4/27/19,A,Juventus FC,Inter Milan,1:01,CF,62,1:01,Left-footed shot,Miralem Pjanic,National Leagues,Italian Football Federation (FIGC),Matchday,2019-04-27,2019,1:01,1,1,1,1,Normal,CF,62
2018/2019,Serie A,35,05-03-19,H,Juventus FC,Torino FC,1:01,CF,84,1:01,Header,Leonardo Spinazzola,National Leagues,Italian Football Federation (FIGC),Matchday,2019-05-03,2019,1:01,1,1,1,1,Normal,CF,84
2019/2020,Serie A,2,8/31/19,H,Juventus FC,SSC Napoli,4:03,LW,62,3:00,Left-footed shot,Douglas Costa,National Leagues,Italian Football Federation (FIGC),Matchday,2019-08-31,2019,4:03,4,3,4,3,Normal,LW,62
2019/2020,Serie A,4,9/21/19,H,Juventus FC,Hellas Verona,2:01,LW,49,2:01,Penalty,No assist,National Leagues,Italian Football Federation (FIGC),Matchday,2019-09-21,2019,2:01,2,1,2,1,Normal,LW,49
2019/2020,Serie A,6,9/28/19,H,Juventus FC,SPAL,2:00,CF,78,2:00,Header,Paulo Dybala,National Leagues,Italian Football Federation (FIGC),Matchday,2019-09-28,2019,2:00,2,0,2,0,Normal,CF,78
2019/2020,UEFA Champions League,Group Stage,10-01-19,H,Juventus FC,Bayer 04 Leverkusen,3:00,CF,89,3:00,Right-footed shot,Paulo Dybala,International,UEFA,Stage,2019-10-01,2019,3:00,3,0,3,0,Normal,CF,89
2019/2020,Serie A,8,10/19/19,H,Juventus FC,Bologna FC 1909,2:01,CF,19,1:00,Right-footed shot,No assist,National Leagues,Italian Football Federation (FIGC),Matchday,2019-10-19,2019,2:01,2,1,2,1,Normal,CF,19
2019/2020,Serie A,10,10/30/19,H,Juventus FC,Genoa CFC,2:01,CF,90+6,2:01,Penalty,No assist,National Leagues,Italian Football Federation (FIGC),Matchday,2019-10-30,2019,2:01,2,1,2,1,Normal,CF,96
2019/2020,Serie A,14,12-01-19,H,Juventus FC,US Sassuolo,2:02,CF,68,2:02,Penalty,No assist,National Leagues,Italian Football Federation (FIGC),Matchday,2019-12-01,2019,2:02,2,2,2,2,Normal,CF,68
2019/2020,Serie A,15,12-07-19,A,Juventus FC,SS Lazio,3:01,CF,25,0:01,Tap-in,Rodrigo Bentancur,National Leagues,Italian Football Federation (FIGC),Matchday,2019-12-07,2019,3:01,3,1,1,3,Normal,CF,25
2019/2020,UEFA Champions League,Group Stage,12-11-19,A,Juventus FC,Bayer 04 Leverkusen,0:02,CF,75,0:01,Right-footed shot,Paulo Dybala,International,UEFA,Stage,2019-12-11,2019,0:02,0,2,2,0,Normal,CF,75
2019/2020,Serie A,16,12/15/19,H,Juventus FC,Udinese Calcio,3:01,CF,9,1:00,Right-footed shot,No assist,National Leagues,Italian Football Federation (FIGC),Matchday,2019-12-15,2019,3:01,3,1,3,1,Normal,CF,9
2019/2020,Serie A,16,12/15/19,H,Juventus FC,Udinese Calcio,3:01,CF,37,2:00,Left-footed shot,Gonzalo Higuain,National Leagues,Italian Football Federation (FIGC),Matchday,2019-12-15,2019,3:01,3,1,3,1,Normal,CF,37
2019/2020,Serie A,17,12/18/19,A,Juventus FC,UC Sampdoria,1:02,LW,45,1:02,Header,Alex Sandro,National Leagues,Italian Football Federation (FIGC),Matchday,2019-12-18,2019,1:02,1,2,2,1,Normal,LW,45
2019/2020,Serie A,18,01-06-20,H,Juventus FC,Cagliari Calcio,4:00,CF,49,1:00,Right-footed shot,No assist,National Leagues,Italian Football Federation (FIGC),Matchday,2020-01-06,2020,4:00,4,0,4,0,Normal,CF,49
2019/2020,Serie A,18,01-06-20,H,Juventus FC,Cagliari Calcio,4:00,CF,67,2:00,Penalty,No assist,National Leagues,Italian Football Federation (FIGC),Matchday,2020-01-06,2020,4:00,4,0,4,0,Normal,CF,67
2019/2020,Serie A,18,01-06-20,H,Juventus FC,Cagliari Calcio,4:00,CF,82,4:00,Left-footed shot,Douglas Costa,National Leagues,Italian Football Federation (FIGC),Matchday,2020-01-06,2020,4:00,4,0,4,0,Normal,CF,82
2019/2020,Serie A,19,01-12-20,A,Juventus FC,AS Roma,1:02,CF,10,0:02,Penalty,No assist,National Leagues,Italian Football Federation (FIGC),Matchday,2020-01-12,2020,1:02,1,2,2,1,Normal,CF,10
2019/2020,Serie A,20,1/19/20,H,Juventus FC,Parma Calcio 1913,2:01,CF,43,1:00,Deflected shot on goal,Blaise Matuidi,National Leagues,Italian Football Federation (FIGC),Matchday,2020-01-19,2020,2:01,2,1,2,1,Normal,CF,43
2019/2020,Serie A,20,1/19/20,H,Juventus FC,Parma Calcio 1913,2:01,CF,58,2:01,Right-footed shot,Paulo Dybala,National Leagues,Italian Football Federation (FIGC),Matchday,2020-01-19,2020,2:01,2,1,2,1,Normal,CF,58
2019/2020,Italy Cup,Quarter-Finals,1/22/20,H,Juventus FC,AS Roma,3:01,LW,26,1:00,Left-footed shot,Gonzalo Higuain,National Cups,Italian Football Federation (FIGC),Stage,2020-01-22,2020,3:01,3,1,3,1,Normal,LW,26
2019/2020,Serie A,21,1/26/20,A,Juventus FC,SSC Napoli,2:01,LW,90,2:01,Right-footed shot,Rodrigo Bentancur,National Leagues,Italian Football Federation (FIGC),Matchday,2020-01-26,2020,2:01,2,1,1,2,Normal,LW,90
2019/2020,Serie A,22,02-02-20,H,Juventus FC,ACF Fiorentina,3:00,LW,40,1:00,Penalty,No assist,National Leagues,Italian Football Federation (FIGC),Matchday,2020-02-02,2020,3:00,3,0,3,0,Normal,LW,40
2019/2020,Serie A,22,02-02-20,H,Juventus FC,ACF Fiorentina,3:00,LW,80,2:00,Penalty,No assist,National Leagues,Italian Football Federation (FIGC),Matchday,2020-02-02,2020,3:00,3,0,3,0,Normal,LW,80
2019/2020,Serie A,23,02-08-20,A,Juventus FC,Hellas Verona,2:01,LW,65,0:01,Right-footed shot,Rodrigo Bentancur,National Leagues,Italian Football Federation (FIGC),Matchday,2020-02-08,2020,2:01,2,1,1,2,Normal,LW,65
2019/2020,Italy Cup,Semi-Finals,2/13/20,A,Juventus FC,AC Milan,1:01,LW,90+1,1:01,Penalty,No assist,National Cups,Italian Football Federation (FIGC),Stage,2020-02-13,2020,1:01,1,1,1,1,Normal,LW,91
2019/2020,Serie A,25,2/22/20,A,Juventus FC,SPAL,1:02,LW,39,0:01,Tap-in,Juan Cuadrado,National Leagues,Italian Football Federation (FIGC),Matchday,2020-02-22,2020,1:02,1,2,2,1,Normal,LW,39
2019/2020,Serie A,27,6/22/20,A,Juventus FC,Bologna FC 1909,0:02,LW,23,0:01,Penalty,No assist,National Leagues,Italian Football Federation (FIGC),Matchday,2020-06-22,2020,0:02,0,2,2,0,Normal,LW,23
2019/2020,Serie A,28,6/26/20,H,Juventus FC,US Lecce,4:00,LW,62,2:00,Penalty,No assist,National Leagues,Italian Football Federation (FIGC),Matchday,2020-06-26,2020,4:00,4,0,4,0,Normal,LW,62
2019/2020,Serie A,29,6/30/20,A,Juventus FC,Genoa CFC,1:03,LW,56,0:02,Long distance kick,Miralem Pjanic,National Leagues,Italian Football Federation (FIGC),Matchday,2020-06-30,2020,1:03,1,3,3,1,Normal,LW,56
2019/2020,Serie A,30,07-04-20,H,Juventus FC,Torino FC,4:01,LW,61,3:01,Direct free kick,No assist,National Leagues,Italian Football Federation (FIGC),Matchday,2020-07-04,2020,4:01,4,1,4,1,Normal,LW,61
2019/2020,Serie A,31,07-07-20,A,Juventus FC,AC Milan,4:02,LW,53,0:02,Left-footed shot,Juan Cuadrado,National Leagues,Italian Football Federation (FIGC),Matchday,2020-07-07,2020,4:02,4,2,2,4,Normal,LW,53
2019/2020,Serie A,32,07-11-20,H,Juventus FC,Atalanta BC,2:02,LW,55,1:01,Penalty,No assist,National Leagues,Italian Football Federation (FIGC),Matchday,2020-07-11,2020,2:02,2,2,2,2,Normal,LW,55
2019/2020,Serie A,32,07-11-20,H,Juventus FC,Atalanta BC,2:02,LW,90,2:02,Penalty,No assist,National Leagues,Italian Football Federation (FIGC),Matchday,2020-07-11,2020,2:02,2,2,2,2,Normal,LW,90
2019/2020,Serie A,34,7/20/20,H,Juventus FC,SS Lazio,2:01,LW,51,1:00,Penalty,No assist,National Leagues,Italian Football Federation (FIGC),Matchday,2020-07-20,2020,2:01,2,1,2,1,Normal,LW,51
2019/2020,Serie A,34,7/20/20,H,Juventus FC,SS Lazio,2:01,LW,54,2:00,Counter attack goal,Paulo Dybala,National Leagues,Italian Football Federation (FIGC),Matchday,2020-07-20,2020,2:01,2,1,2,1,Normal,LW,54
2019/2020,Serie A,36,7/26/20,H,Juventus FC,UC Sampdoria,2:00,LW,45+7,1:00,Right-footed shot,Miralem Pjanic,National Leagues,Italian Football Federation (FIGC),Matchday,2020-07-26,2020,2:00,2,0,2,0,Normal,LW,52
2019/2020,UEFA Champions League,Last 16,08-07-20,H,Juventus FC,Olympique Lyon,2:01,LW,43,1:01,Penalty,No assist,International,UEFA,Stage,2020-08-07,2020,2:01,2,1,2,1,Normal,LW,43
2019/2020,UEFA Champions League,Last 16,08-07-20,H,Juventus FC,Olympique Lyon,2:01,LW,60,2:01,Left-footed shot,Federico Bernardeschi,International,UEFA,Stage,2020-08-07,2020,2:01,2,1,2,1,Normal,LW,60
2020/2021,Serie A,1,9/20/20,H,Juventus FC,UC Sampdoria,3:00,CF,88,3:00,Right-footed shot,Aaron Ramsey,National Leagues,Italian Football Federation (FIGC),Matchday,2020-09-20,2020,3:00,3,0,3,0,Normal,CF,88
2020/2021,Serie A,2,9/27/20,A,Juventus FC,AS Roma,2:02,CF,44,1:01,Penalty,No assist,National Leagues,Italian Football Federation (FIGC),Matchday,2020-09-27,2020,2:02,2,2,2,2,Normal,CF,44
2020/2021,Serie A,2,9/27/20,A,Juventus FC,AS Roma,2:02,CF,69,2:02,Header,Danilo,National Leagues,Italian Football Federation (FIGC),Matchday,2020-09-27,2020,2:02,2,2,2,2,Normal,CF,69
2020/2021,Serie A,6,11-01-20,A,Juventus FC,Spezia Calcio,1:04,CF,59,1:02,Right-footed shot,alvaro Morata,National Leagues,Italian Football Federation (FIGC),Matchday,2020-11-01,2020,1:04,1,4,4,1,Normal,CF,59
2020/2021,Serie A,6,11-01-20,A,Juventus FC,Spezia Calcio,1:04,CF,76,1:04,Penalty,No assist,National Leagues,Italian Football Federation (FIGC),Matchday,2020-11-01,2020,1:04,1,4,4,1,Normal,CF,76
2020/2021,Serie A,7,11-08-20,A,Juventus FC,SS Lazio,1:01,LW,15,0:01,Right-footed shot,Juan Cuadrado,National Leagues,Italian Football Federation (FIGC),Matchday,2020-11-08,2020,1:01,1,1,1,1,Normal,LW,15
2020/2021,Serie A,8,11/21/20,H,Juventus FC,Cagliari Calcio,2:00,CF,38,1:00,Right-footed shot,alvaro Morata,National Leagues,Italian Football Federation (FIGC),Matchday,2020-11-21,2020,2:00,2,0,2,0,Normal,CF,38
2020/2021,Serie A,8,11/21/20,H,Juventus FC,Cagliari Calcio,2:00,CF,42,2:00,Right-footed shot,Merih Demiral,National Leagues,Italian Football Federation (FIGC),Matchday,2020-11-21,2020,2:00,2,0,2,0,Normal,CF,42
2020/2021,UEFA Champions League,Group Stage,11/24/20,H,Juventus FC,Ferencvarosi TC,2:01,CF,35,1:01,Left-footed shot,Juan Cuadrado,International,UEFA,Stage,2020-11-24,2020,2:01,2,1,2,1,Normal,CF,35
2020/2021,UEFA Champions League,Group Stage,12-02-20,H,Juventus FC,Dynamo Kyiv,3:00,CF,57,2:00,Right-footed shot,alvaro Morata,International,UEFA,Stage,2020-12-02,2020,3:00,3,0,3,0,Normal,CF,57
2020/2021,UEFA Champions League,Group Stage,12-08-20,A,Juventus FC,FC Barcelona,0:03,CF,13,0:01,Penalty,No assist,International,UEFA,Stage,2020-12-08,2020,0:03,0,3,3,0,Normal,CF,13
2020/2021,UEFA Champions League,Group Stage,12-08-20,A,Juventus FC,FC Barcelona,0:03,CF,52,0:03,Penalty,No assist,International,UEFA,Stage,2020-12-08,2020,0:03,0,3,3,0,Normal,CF,52
2020/2021,Serie A,11,12/13/20,A,Juventus FC,Genoa CFC,1:03,CF,78,1:02,Penalty,No assist,National Leagues,Italian Football Federation (FIGC),Matchday,2020-12-13,2020,1:03,1,3,3,1,Normal,CF,78
2020/2021,Serie A,11,12/13/20,A,Juventus FC,Genoa CFC,1:03,CF,89,1:03,Penalty,No assist,National Leagues,Italian Football Federation (FIGC),Matchday,2020-12-13,2020,1:03,1,3,3,1,Normal,CF,89
2020/2021,Serie A,13,12/19/20,A,Juventus FC,Parma Calcio 1913,0:04,CF,26,0:02,Header,alvaro Morata,National Leagues,Italian Football Federation (FIGC),Matchday,2020-12-19,2020,0:04,0,4,4,0,Normal,CF,26
2020/2021,Serie A,13,12/19/20,A,Juventus FC,Parma Calcio 1913,0:04,CF,48,0:03,Left-footed shot,Aaron Ramsey,National Leagues,Italian Football Federation (FIGC),Matchday,2020-12-19,2020,0:04,0,4,4,0,Normal,CF,48
2020/2021,Serie A,15,01-03-21,H,Juventus FC,Udinese Calcio,4:01,CF,31,1:00,Right-footed shot,Aaron Ramsey,National Leagues,Italian Football Federation (FIGC),Matchday,2021-01-03,2021,4:01,4,1,4,1,Normal,CF,31
2020/2021,Serie A,15,01-03-21,H,Juventus FC,Udinese Calcio,4:01,CF,70,3:00,Left-footed shot,Rodrigo Bentancur,National Leagues,Italian Football Federation (FIGC),Matchday,2021-01-03,2021,4:01,4,1,4,1,Normal,CF,70
2020/2021,Serie A,17,01-10-21,H,Juventus FC,US Sassuolo,3:01,CF,90+2,3:01,Right-footed shot,Danilo,National Leagues,Italian Football Federation (FIGC),Matchday,2021-01-10,2021,3:01,3,1,3,1,Normal,CF,92
2020/2021,Supercoppa Italiana,Final,1/20/21,H,Juventus FC,SSC Napoli,2:00,CF,64,1:00,Tap-in,No assist,National SuperCups,Italian Football Federation (FIGC),Stage,2021-01-20,2021,2:00,2,0,2,0,Normal,CF,64
2020/2021,Italy Cup,Semi-Finals,02-02-21,A,Juventus FC,Inter Milan,1:02,CF,26,1:01,Penalty,No assist,National Cups,Italian Football Federation (FIGC),Stage,2021-02-02,2021,1:02,1,2,2,1,Normal,CF,26
2020/2021,Italy Cup,Semi-Finals,02-02-21,A,Juventus FC,Inter Milan,1:02,CF,35,1:02,Left-footed shot,No assist,National Cups,Italian Football Federation (FIGC),Stage,2021-02-02,2021,1:02,1,2,2,1,Normal,CF,35
2020/2021,Serie A,21,02-06-21,H,Juventus FC,AS Roma,2:00,CF,13,1:00,Left-footed shot,alvaro Morata,National Leagues,Italian Football Federation (FIGC),Matchday,2021-02-06,2021,2:00,2,0,2,0,Normal,CF,13
2020/2021,Serie A,23,2/22/21,H,Juventus FC,FC Crotone,3:00,CF,38,1:00,Header,Alex Sandro,National Leagues,Italian Football Federation (FIGC),Matchday,2021-02-22,2021,3:00,3,0,3,0,Normal,CF,38
2020/2021,Serie A,23,2/22/21,H,Juventus FC,FC Crotone,3:00,CF,45+1,2:00,Header,Aaron Ramsey,National Leagues,Italian Football Federation (FIGC),Matchday,2021-02-22,2021,3:00,3,0,3,0,Normal,CF,46
2020/2021,Serie A,24,2/27/21,A,Juventus FC,Hellas Verona,1:01,CF,49,0:01,Right-footed shot,Federico Chiesa,National Leagues,Italian Football Federation (FIGC),Matchday,2021-02-27,2021,1:01,1,1,1,1,Normal,CF,49
2020/2021,Serie A,25,03-02-21,H,Juventus FC,Spezia Calcio,3:00,CF,89,3:00,Counter attack goal,Rodrigo Bentancur,National Leagues,Italian Football Federation (FIGC),Matchday,2021-03-02,2021,3:00,3,0,3,0,Normal,CF,89
2020/2021,Serie A,27,3/14/21,A,Juventus FC,Cagliari Calcio,1:03,CF,10,0:01,Header,Juan Cuadrado,National Leagues,Italian Football Federation (FIGC),Matchday,2021-03-14,2021,1:03,1,3,3,1,Normal,CF,10
2020/2021,Serie A,27,3/14/21,A,Juventus FC,Cagliari Calcio,1:03,CF,25,0:02,Penalty,No assist,National Leagues,Italian Football Federation (FIGC),Matchday,2021-03-14,2021,1:03,1,3,3,1,Normal,CF,25
2020/2021,Serie A,27,3/14/21,A,Juventus FC,Cagliari Calcio,1:03,CF,32,0:03,Left-footed shot,Federico Chiesa,National Leagues,Italian Football Federation (FIGC),Matchday,2021-03-14,2021,1:03,1,3,3,1,Normal,CF,32
2020/2021,Serie A,29,04-03-21,A,Juventus FC,Torino FC,2:02,CF,79,2:02,Header,Giorgio Chiellini,National Leagues,Italian Football Federation (FIGC),Matchday,2021-04-03,2021,2:02,2,2,2,2,Normal,CF,79
2020/2021,Serie A,3,04-07-21,H,Juventus FC,SSC Napoli,2:01,CF,13,1:00,Right-footed shot,Federico Chiesa,National Leagues,Italian Football Federation (FIGC),Matchday,2021-04-07,2021,2:01,2,1,2,1,Normal,CF,13
2020/2021,Serie A,34,05-02-21,A,Juventus FC,Udinese Calcio,1:02,CF,83,1:01,Penalty,No assist,National Leagues,Italian Football Federation (FIGC),Matchday,2021-05-02,2021,1:02,1,2,2,1,Normal,CF,83
2020/2021,Serie A,34,05-02-21,A,Juventus FC,Udinese Calcio,1:02,CF,89,1:02,Header,Adrien Rabiot,National Leagues,Italian Football Federation (FIGC),Matchday,2021-05-02,2021,1:02,1,2,2,1,Normal,CF,89
2020/2021,Serie A,36,05-12-21,A,Juventus FC,US Sassuolo,1:03,CF,45,0:02,Left-footed shot,No assist,National Leagues,Italian Football Federation (FIGC),Matchday,2021-05-12,2021,1:03,1,3,3,1,Normal,CF,45
2020/2021,Serie A,37,5/15/21,H,Juventus FC,Inter Milan,3:02,CF,24,1:00,Penalty rebound,No assist,National Leagues,Italian Football Federation (FIGC),Matchday,2021-05-15,2021,3:02,3,2,3,2,Normal,CF,24
2021/2022,Premier League,4,09-11-21,H,Manchester United,Newcastle United,4:01,CF,45+2,1:00,Tap-in,No assist,National Leagues,English Football Association (FA),Matchday,2021-09-11,2021,4:01,4,1,4,1,Normal,CF,47
2021/2022,Premier League,4,09-11-21,H,Manchester United,Newcastle United,4:01,CF,62,2:01,Left-footed shot,Luke Shaw,National Leagues,English Football Association (FA),Matchday,2021-09-11,2021,4:01,4,1,4,1,Normal,CF,62
2021/2022,UEFA Champions League,Group Stage,9/14/21,A,Manchester United,BSC Young Boys,2:01,CF,13,0:01,Right-footed shot,Bruno Fernandes,International,UEFA,Stage,2021-09-14,2021,2:01,2,1,1,2,Normal,CF,13
2021/2022,Premier League,5,9/19/21,A,Manchester United,West Ham United,1:02,CF,35,1:01,Right-footed shot,No assist,National Leagues,English Football Association (FA),Matchday,2021-09-19,2021,1:02,1,2,2,1,Normal,CF,35
2021/2022,UEFA Champions League,Group Stage,9/29/21,H,Manchester United,Villarreal CF,2:01,CF,90+5,2:01,Right-footed shot,Jesse Lingard,International,UEFA,Stage,2021-09-29,2021,2:01,2,1,2,1,Normal,CF,95
2021/2022,UEFA Champions League,Group Stage,10/20/21,H,Manchester United,Atalanta BC,3:02,CF,81,3:02,Header,Luke Shaw,International,UEFA,Stage,2021-10-20,2021,3:02,3,2,3,2,Normal,CF,81
2021/2022,Premier League,10,10/30/21,A,Manchester United,Tottenham Hotspur,0:03,CF,39,0:01,Right-footed shot,Bruno Fernandes,National Leagues,English Football Association (FA),Matchday,2021-10-30,2021,0:03,0,3,3,0,Normal,CF,39
2021/2022,UEFA Champions League,Group Stage,11-02-21,A,Manchester United,Atalanta BC,2:02,CF,45+1,1:01,Right-footed shot,Bruno Fernandes,International,UEFA,Stage,2021-11-02,2021,2:02,2,2,2,2,Normal,CF,46
2021/2022,UEFA Champions League,Group Stage,11-02-21,A,Manchester United,Atalanta BC,2:02,CF,90+1,2:02,Right-footed shot,Mason Greenwood,International,UEFA,Stage,2021-11-02,2021,2:02,2,2,2,2,Normal,CF,91
2021/2022,UEFA Champions League,Group Stage,11/23/21,A,Manchester United,Villarreal CF,0:02,CF,78,0:01,Right-footed shot,No assist,International,UEFA,Stage,2021-11-23,2021,0:02,0,2,2,0,Normal,CF,78
2021/2022,Premier League,14,12-02-21,H,Manchester United,Arsenal FC,3:02,CF,52,2:01,Right-footed shot,Marcus Rashford,National Leagues,English Football Association (FA),Matchday,2021-12-02,2021,3:02,3,2,3,2,Normal,CF,52
2021/2022,Premier League,14,12-02-21,H,Manchester United,Arsenal FC,3:02,CF,70,3:02,Penalty,No assist,National Leagues,English Football Association (FA),Matchday,2021-12-02,2021,3:02,3,2,3,2,Normal,CF,70
2021/2022,Premier League,16,12-11-21,A,Manchester United,Norwich City,0:01,CF,75,0:01,Penalty,No assist,National Leagues,English Football Association (FA),Matchday,2021-12-11,2021,0:01,0,1,1,0,Normal,CF,75
2021/2022,Premier League,20,12/30/21,H,Manchester United,Burnley FC,3:01,CF,35,3:00,Right-footed shot,No assist,National Leagues,English Football Association (FA),Matchday,2021-12-30,2021,3:01,3,1,3,1,Normal,CF,35
2021/2022,Premier League,18,2/15/22,H,Manchester United,Brighton & Hove Albion,2:00,CF,51,1:00,Right-footed shot,Scott McTominay,National Leagues,English Football Association (FA),Matchday,2022-02-15,2022,2:00,2,0,2,0,Normal,CF,51
2021/2022,Premier League,29,03-12-22,H,Manchester United,Tottenham Hotspur,3:02,CF,12,1:00,Right-footed shot,Fred,National Leagues,English Football Association (FA),Matchday,2022-03-12,2022,3:02,3,2,3,2,Normal,CF,12
2021/2022,Premier League,29,03-12-22,H,Manchester United,Tottenham Hotspur,3:02,CF,38,2:01,Right-footed shot,Jadon Sancho,National Leagues,English Football Association (FA),Matchday,2022-03-12,2022,3:02,3,2,3,2,Normal,CF,38
2021/2022,Premier League,29,03-12-22,H,Manchester United,Tottenham Hotspur,3:02,CF,81,3:02,Header,Alex Telles,National Leagues,English Football Association (FA),Matchday,2022-03-12,2022,3:02,3,2,3,2,Normal,CF,81
2021/2022,Premier League,33,4/16/22,H,Manchester United,Norwich City,3:02,CF,7,1:00,Right-footed shot,Anthony Elanga,National Leagues,English Football Association (FA),Matchday,2022-04-16,2022,3:02,3,2,3,2,Normal,CF,7
2021/2022,Premier League,33,4/16/22,H,Manchester United,Norwich City,3:02,CF,32,2:00,Header,Alex Telles,National Leagues,English Football Association (FA),Matchday,2022-04-16,2022,3:02,3,2,3,2,Normal,CF,32
2021/2022,Premier League,33,4/16/22,H,Manchester United,Norwich City,3:02,CF,76,3:02,Direct free kick,No assist,National Leagues,English Football Association (FA),Matchday,2022-04-16,2022,3:02,3,2,3,2,Normal,CF,76
2021/2022,Premier League,34,4/23/22,A,Manchester United,Arsenal FC,3:01,CF,34,2:01,Left-footed shot,Nemanja Matić,National Leagues,English Football Association (FA),Matchday,2022-04-23,2022,3:01,3,1,1,3,Normal,CF,34
2021/2022,Premier League,37,4/28/22,H,Manchester United,Chelsea FC,1:01,CF,62,1:01,Right-footed shot,Nemanja Matić,National Leagues,English Football Association (FA),Matchday,2022-04-28,2022,1:01,1,1,1,1,Normal,CF,62
2021/2022,Premier League,35,05-02-22,H,Manchester United,Brentford FC,3:00,CF,61,2:00,Penalty,No assist,National Leagues,English Football Association (FA),Matchday,2022-05-02,2022,3:00,3,0,3,0,Normal,CF,61
2022/2023,Europa League,Group Stage,9/15/22,A,Manchester United,FC Sheriff,0:02,CF,39,0:02,Penalty,No assist,International,UEFA,Stage,2022-09-15,2022,0:02,0,2,2,0,Normal,CF,39
2022/2023,Premier League,10,10/9/22,A,Manchester United,Everton FC,1:2,,44,1:2,Counter attack goal,Casemiro,National Leagues,English Football Association (FA),Matchday,2022-10-09,2022,1:2,1,2,2,1,Normal,LW,44
2022/2023,Europa League,Group Stage,10/27/22,H,Manchester United,FC Sheriff,3:0,CF,81,3:0,Left-footed shot,No assist,International,UEFA,Stage,2022-10-27,2022,3:0,3,0,3,0,Normal,CF,81
2022/2023,Saudi Pro League,15,2/3/23,A,Al-Nassr FC,Al-Fateh,2:2,CF,90+3,2:2,Penalty,No assist,National Leagues,Saudi Arabian Football Federation (SAFF),Matchday,2023-02-03,2023,2:2,2,2,2,2,Normal,CF,93
2022/2023,Saudi Pro League,16,2/9/23,A,Al-Nassr FC,Al-Wehda FC,0:4,CF,21,0:1,Left-footed shot,Abdulrahman Ghareeb,National Leagues,Saudi Arabian Football Federation (SAFF),Matchday,2023-02-09,2023,0:4,0,4,4,0,Normal,CF,21
2022/2023,Saudi Pro League,16,2/9/23,A,Al-Nassr FC,Al-Wehda FC,0:4,CF,40,0:2,Right-footed shot,Sami Al-Najei,National Leagues,Saudi Arabian Football Federation (SAFF),Matchday,2023-02-09,2023,0:4,0,4,4,0,Normal,CF,40
2022/2023,Saudi Pro League,16,2/9/23,A,Al-Nassr FC,Al-Wehda FC,0:4,CF,53,0:3,Penalty,No assist,National Leagues,Saudi Arabian Football Federation (SAFF),Matchday,2023-02-09,2023,0:4,0,4,4,0,Normal,CF,53
2022/2023,Saudi Pro League,16,2/9/23,A,Al-Nassr FC,Al-Wehda FC,0:4,CF,61,0:4,Right-footed shot,No assist,National Leagues,Saudi Arabian Football Federation (SAFF),Matchday,2023-02-09,2023,0:4,0,4,4,0,Normal,CF,61
2022/2023,Saudi Pro League,18,2/25/23,A,Al-Nassr FC,Damac FC,0:3,CF,18,0:1,Penalty,	,National Leagues,Saudi Arabian Football Federation (SAFF),Matchday,2023-02-25,2023,0:3,0,3,3,0,Normal,CF,18
2022/2023,Saudi Pro League,18,2/25/23,A,Al-Nassr FC,Damac FC,0:3,CF,23,0:2,Left-footed shot,Sultan Al-Ghannam,National Leagues,Saudi Arabian Football Federation (SAFF),Matchday,2023-02-25,2023,0:3,0,3,3,0,Normal,CF,23
2022/2023,Saudi Pro League,18,2/25/23,A,Al-Nassr FC,Damac FC,0:3,CF,44,0:3,Counter attack goal,Ayman Yahya,National Leagues,Saudi Arabian Football Federation (SAFF),Matchday,2023-02-25,2023,0:3,0,3,3,0,Normal,CF,44
2022/2023,Saudi Pro League,21,3/18/23,H,Al-Nassr FC,Abha Club,2:1,CF,78,1:1,Direct free kick,No assist,National Leagues,Saudi Arabian Football Federation (SAFF),Matchday,2023-03-18,2023,2:1,2,1,2,1,Normal,CF,78
